code_point	symbol	block	block_name	name	tab_completion	latex_code
10100	"""ğ„€"""	10100..1013F	Aegean Numbers	Aegean word separator line		
10101	"""ğ„"""	10100..1013F	Aegean Numbers	Aegean word separator dot		
10102	"""ğ„‚"""	10100..1013F	Aegean Numbers	Aegean check mark		
10107	"""ğ„‡"""	10100..1013F	Aegean Numbers	Aegean number one		
10108	"""ğ„ˆ"""	10100..1013F	Aegean Numbers	Aegean number two		
10109	"""ğ„‰"""	10100..1013F	Aegean Numbers	Aegean number three		
1010A	"""ğ„Š"""	10100..1013F	Aegean Numbers	Aegean number four		
1010B	"""ğ„‹"""	10100..1013F	Aegean Numbers	Aegean number five		
1010C	"""ğ„Œ"""	10100..1013F	Aegean Numbers	Aegean number six		
1010D	"""ğ„"""	10100..1013F	Aegean Numbers	Aegean number seven		
1010E	"""ğ„"""	10100..1013F	Aegean Numbers	Aegean number eight		
1010F	"""ğ„"""	10100..1013F	Aegean Numbers	Aegean number nine		
10110	"""ğ„"""	10100..1013F	Aegean Numbers	Aegean number ten		
10111	"""ğ„‘"""	10100..1013F	Aegean Numbers	Aegean number twenty		
10112	"""ğ„’"""	10100..1013F	Aegean Numbers	Aegean number thirty		
10113	"""ğ„“"""	10100..1013F	Aegean Numbers	Aegean number forty		
10114	"""ğ„”"""	10100..1013F	Aegean Numbers	Aegean number fifty		
10115	"""ğ„•"""	10100..1013F	Aegean Numbers	Aegean number sixty		
10116	"""ğ„–"""	10100..1013F	Aegean Numbers	Aegean number seventy		
10117	"""ğ„—"""	10100..1013F	Aegean Numbers	Aegean number eighty		
10118	"""ğ„˜"""	10100..1013F	Aegean Numbers	Aegean number ninety		
10119	"""ğ„™"""	10100..1013F	Aegean Numbers	Aegean number one hundred		
1011A	"""ğ„š"""	10100..1013F	Aegean Numbers	Aegean number two hundred		
1011B	"""ğ„›"""	10100..1013F	Aegean Numbers	Aegean number three hundred		
1011C	"""ğ„œ"""	10100..1013F	Aegean Numbers	Aegean number four hundred		
1011D	"""ğ„"""	10100..1013F	Aegean Numbers	Aegean number five hundred		
1011E	"""ğ„"""	10100..1013F	Aegean Numbers	Aegean number six hundred		
1011F	"""ğ„Ÿ"""	10100..1013F	Aegean Numbers	Aegean number seven hundred		
10120	"""ğ„ """	10100..1013F	Aegean Numbers	Aegean number eight hundred		
10121	"""ğ„¡"""	10100..1013F	Aegean Numbers	Aegean number nine hundred		
10122	"""ğ„¢"""	10100..1013F	Aegean Numbers	Aegean number one thousand		
10123	"""ğ„£"""	10100..1013F	Aegean Numbers	Aegean number two thousand		
10124	"""ğ„¤"""	10100..1013F	Aegean Numbers	Aegean number three thousand		
10125	"""ğ„¥"""	10100..1013F	Aegean Numbers	Aegean number four thousand		
10126	"""ğ„¦"""	10100..1013F	Aegean Numbers	Aegean number five thousand		
10127	"""ğ„§"""	10100..1013F	Aegean Numbers	Aegean number six thousand		
10128	"""ğ„¨"""	10100..1013F	Aegean Numbers	Aegean number seven thousand		
10129	"""ğ„©"""	10100..1013F	Aegean Numbers	Aegean number eight thousand		
1012A	"""ğ„ª"""	10100..1013F	Aegean Numbers	Aegean number nine thousand		
1012B	"""ğ„«"""	10100..1013F	Aegean Numbers	Aegean number ten thousand		
1012C	"""ğ„¬"""	10100..1013F	Aegean Numbers	Aegean number twenty thousand		
1012D	"""ğ„­"""	10100..1013F	Aegean Numbers	Aegean number thirty thousand		
1012E	"""ğ„®"""	10100..1013F	Aegean Numbers	Aegean number forty thousand		
1012F	"""ğ„¯"""	10100..1013F	Aegean Numbers	Aegean number fifty thousand		
10130	"""ğ„°"""	10100..1013F	Aegean Numbers	Aegean number sixty thousand		
10131	"""ğ„±"""	10100..1013F	Aegean Numbers	Aegean number seventy thousand		
10132	"""ğ„²"""	10100..1013F	Aegean Numbers	Aegean number eighty thousand		
10133	"""ğ„³"""	10100..1013F	Aegean Numbers	Aegean number ninety thousand		
10137	"""ğ„·"""	10100..1013F	Aegean Numbers	Aegean weight base unit		
10138	"""ğ„¸"""	10100..1013F	Aegean Numbers	Aegean weight first subunit		
10139	"""ğ„¹"""	10100..1013F	Aegean Numbers	Aegean weight second subunit		
1013A	"""ğ„º"""	10100..1013F	Aegean Numbers	Aegean weight third subunit		
1013B	"""ğ„»"""	10100..1013F	Aegean Numbers	Aegean weight fourth subunit		
1013C	"""ğ„¼"""	10100..1013F	Aegean Numbers	Aegean dry measure first subunit		
1013D	"""ğ„½"""	10100..1013F	Aegean Numbers	Aegean liquid measure first subunit		
1013E	"""ğ„¾"""	10100..1013F	Aegean Numbers	Aegean measure second subunit		
1013F	"""ğ„¿"""	10100..1013F	Aegean Numbers	Aegean measure third subunit		
