code_point	symbol	block	block_name	name	tab_completion	latex_code
U+10300	ğŒ€	10300..1032F	Old Italic	Old italic letter a		
U+10301	ğŒ	10300..1032F	Old Italic	Old italic letter be		
U+10302	ğŒ‚	10300..1032F	Old Italic	Old italic letter ke		
U+10303	ğŒƒ	10300..1032F	Old Italic	Old italic letter de		
U+10304	ğŒ„	10300..1032F	Old Italic	Old italic letter e		
U+10305	ğŒ…	10300..1032F	Old Italic	Old italic letter ve		
U+10306	ğŒ†	10300..1032F	Old Italic	Old italic letter ze		
U+10307	ğŒ‡	10300..1032F	Old Italic	Old italic letter he		
U+10308	ğŒˆ	10300..1032F	Old Italic	Old italic letter the		
U+10309	ğŒ‰	10300..1032F	Old Italic	Old italic letter i		
U+1030A	ğŒŠ	10300..1032F	Old Italic	Old italic letter ka		
U+1030B	ğŒ‹	10300..1032F	Old Italic	Old italic letter el		
U+1030C	ğŒŒ	10300..1032F	Old Italic	Old italic letter em		
U+1030D	ğŒ	10300..1032F	Old Italic	Old italic letter en		
U+1030E	ğŒ	10300..1032F	Old Italic	Old italic letter esh		
U+1030F	ğŒ	10300..1032F	Old Italic	Old italic letter o		
U+10310	ğŒ	10300..1032F	Old Italic	Old italic letter pe		
U+10311	ğŒ‘	10300..1032F	Old Italic	Old italic letter she		
U+10312	ğŒ’	10300..1032F	Old Italic	Old italic letter ku		
U+10313	ğŒ“	10300..1032F	Old Italic	Old italic letter er		
U+10314	ğŒ”	10300..1032F	Old Italic	Old italic letter es		
U+10315	ğŒ•	10300..1032F	Old Italic	Old italic letter te		
U+10316	ğŒ–	10300..1032F	Old Italic	Old italic letter u		
U+10317	ğŒ—	10300..1032F	Old Italic	Old italic letter eks		
U+10318	ğŒ˜	10300..1032F	Old Italic	Old italic letter phe		
U+10319	ğŒ™	10300..1032F	Old Italic	Old italic letter khe		
U+1031A	ğŒš	10300..1032F	Old Italic	Old italic letter ef		
U+1031B	ğŒ›	10300..1032F	Old Italic	Old italic letter ers		
U+1031C	ğŒœ	10300..1032F	Old Italic	Old italic letter che		
U+1031D	ğŒ	10300..1032F	Old Italic	Old italic letter ii		
U+1031E	ğŒ	10300..1032F	Old Italic	Old italic letter uu		
U+1031F	ğŒŸ	10300..1032F	Old Italic	Old italic letter ess		
U+10320	ğŒ 	10300..1032F	Old Italic	Old italic numeral one		
U+10321	ğŒ¡	10300..1032F	Old Italic	Old italic numeral five		
U+10322	ğŒ¢	10300..1032F	Old Italic	Old italic numeral ten		
U+10323	ğŒ£	10300..1032F	Old Italic	Old italic numeral fifty		
U+1032D	ğŒ­	10300..1032F	Old Italic	Old italic letter ye		
U+1032E	ğŒ®	10300..1032F	Old Italic	Old italic letter northern tse		
U+1032F	ğŒ¯	10300..1032F	Old Italic	Old italic letter southern tse		
