code_point	symbol	block	block_name	name	tab_completion	latex_code
10B80	"""ğ®€"""	10B80..10BAF	Psalter Pahlavi	Psalter pahlavi letter aleph		
10B81	"""ğ®"""	10B80..10BAF	Psalter Pahlavi	Psalter pahlavi letter beth		
10B82	"""ğ®‚"""	10B80..10BAF	Psalter Pahlavi	Psalter pahlavi letter gimel		
10B83	"""ğ®ƒ"""	10B80..10BAF	Psalter Pahlavi	Psalter pahlavi letter daleth		
10B84	"""ğ®„"""	10B80..10BAF	Psalter Pahlavi	Psalter pahlavi letter he		
10B85	"""ğ®…"""	10B80..10BAF	Psalter Pahlavi	Psalter pahlavi letter waw-ayin-resh		
10B86	"""ğ®†"""	10B80..10BAF	Psalter Pahlavi	Psalter pahlavi letter zayin		
10B87	"""ğ®‡"""	10B80..10BAF	Psalter Pahlavi	Psalter pahlavi letter heth		
10B88	"""ğ®ˆ"""	10B80..10BAF	Psalter Pahlavi	Psalter pahlavi letter yodh		
10B89	"""ğ®‰"""	10B80..10BAF	Psalter Pahlavi	Psalter pahlavi letter kaph		
10B8A	"""ğ®Š"""	10B80..10BAF	Psalter Pahlavi	Psalter pahlavi letter lamedh		
10B8B	"""ğ®‹"""	10B80..10BAF	Psalter Pahlavi	Psalter pahlavi letter mem-qoph		
10B8C	"""ğ®Œ"""	10B80..10BAF	Psalter Pahlavi	Psalter pahlavi letter nun		
10B8D	"""ğ®"""	10B80..10BAF	Psalter Pahlavi	Psalter pahlavi letter samekh		
10B8E	"""ğ®"""	10B80..10BAF	Psalter Pahlavi	Psalter pahlavi letter pe		
10B8F	"""ğ®"""	10B80..10BAF	Psalter Pahlavi	Psalter pahlavi letter sadhe		
10B90	"""ğ®"""	10B80..10BAF	Psalter Pahlavi	Psalter pahlavi letter shin		
10B91	"""ğ®‘"""	10B80..10BAF	Psalter Pahlavi	Psalter pahlavi letter taw		
10B99	"""ğ®™"""	10B80..10BAF	Psalter Pahlavi	Psalter pahlavi section mark		
10B9A	"""ğ®š"""	10B80..10BAF	Psalter Pahlavi	Psalter pahlavi turned section mark		
10B9B	"""ğ®›"""	10B80..10BAF	Psalter Pahlavi	Psalter pahlavi four dots with cross		
10B9C	"""ğ®œ"""	10B80..10BAF	Psalter Pahlavi	Psalter pahlavi four dots with dot		
10BA9	"""ğ®©"""	10B80..10BAF	Psalter Pahlavi	Psalter pahlavi number one		
10BAA	"""ğ®ª"""	10B80..10BAF	Psalter Pahlavi	Psalter pahlavi number two		
10BAB	"""ğ®«"""	10B80..10BAF	Psalter Pahlavi	Psalter pahlavi number three		
10BAC	"""ğ®¬"""	10B80..10BAF	Psalter Pahlavi	Psalter pahlavi number four		
10BAD	"""ğ®­"""	10B80..10BAF	Psalter Pahlavi	Psalter pahlavi number ten		
10BAE	"""ğ®®"""	10B80..10BAF	Psalter Pahlavi	Psalter pahlavi number twenty		
10BAF	"""ğ®¯"""	10B80..10BAF	Psalter Pahlavi	Psalter pahlavi number one hundred		
