code_point	symbol	block	block_name	name	tab_completion	latex_code
U+11900	ğ‘¤€	11900..1195F	Dives Akuru	Dives akuru letter a		
U+11901	ğ‘¤	11900..1195F	Dives Akuru	Dives akuru letter aa		
U+11902	ğ‘¤‚	11900..1195F	Dives Akuru	Dives akuru letter i		
U+11903	ğ‘¤ƒ	11900..1195F	Dives Akuru	Dives akuru letter ii		
U+11904	ğ‘¤„	11900..1195F	Dives Akuru	Dives akuru letter u		
U+11905	ğ‘¤…	11900..1195F	Dives Akuru	Dives akuru letter uu		
U+11906	ğ‘¤†	11900..1195F	Dives Akuru	Dives akuru letter e		
U+11909	ğ‘¤‰	11900..1195F	Dives Akuru	Dives akuru letter o		
U+1190C	ğ‘¤Œ	11900..1195F	Dives Akuru	Dives akuru letter ka		
U+1190D	ğ‘¤	11900..1195F	Dives Akuru	Dives akuru letter kha		
U+1190E	ğ‘¤	11900..1195F	Dives Akuru	Dives akuru letter ga		
U+1190F	ğ‘¤	11900..1195F	Dives Akuru	Dives akuru letter gha		
U+11910	ğ‘¤	11900..1195F	Dives Akuru	Dives akuru letter nga		
U+11911	ğ‘¤‘	11900..1195F	Dives Akuru	Dives akuru letter ca		
U+11912	ğ‘¤’	11900..1195F	Dives Akuru	Dives akuru letter cha		
U+11913	ğ‘¤“	11900..1195F	Dives Akuru	Dives akuru letter ja		
U+11915	ğ‘¤•	11900..1195F	Dives Akuru	Dives akuru letter nya		
U+11916	ğ‘¤–	11900..1195F	Dives Akuru	Dives akuru letter tta		
U+11918	ğ‘¤˜	11900..1195F	Dives Akuru	Dives akuru letter dda		
U+11919	ğ‘¤™	11900..1195F	Dives Akuru	Dives akuru letter ddha		
U+1191A	ğ‘¤š	11900..1195F	Dives Akuru	Dives akuru letter nna		
U+1191B	ğ‘¤›	11900..1195F	Dives Akuru	Dives akuru letter ta		
U+1191C	ğ‘¤œ	11900..1195F	Dives Akuru	Dives akuru letter tha		
U+1191D	ğ‘¤	11900..1195F	Dives Akuru	Dives akuru letter da		
U+1191E	ğ‘¤	11900..1195F	Dives Akuru	Dives akuru letter dha		
U+1191F	ğ‘¤Ÿ	11900..1195F	Dives Akuru	Dives akuru letter na		
U+11920	ğ‘¤ 	11900..1195F	Dives Akuru	Dives akuru letter pa		
U+11921	ğ‘¤¡	11900..1195F	Dives Akuru	Dives akuru letter pha		
U+11922	ğ‘¤¢	11900..1195F	Dives Akuru	Dives akuru letter ba		
U+11923	ğ‘¤£	11900..1195F	Dives Akuru	Dives akuru letter bha		
U+11924	ğ‘¤¤	11900..1195F	Dives Akuru	Dives akuru letter ma		
U+11925	ğ‘¤¥	11900..1195F	Dives Akuru	Dives akuru letter ya		
U+11926	ğ‘¤¦	11900..1195F	Dives Akuru	Dives akuru letter yya		
U+11927	ğ‘¤§	11900..1195F	Dives Akuru	Dives akuru letter ra		
U+11928	ğ‘¤¨	11900..1195F	Dives Akuru	Dives akuru letter la		
U+11929	ğ‘¤©	11900..1195F	Dives Akuru	Dives akuru letter va		
U+1192A	ğ‘¤ª	11900..1195F	Dives Akuru	Dives akuru letter sha		
U+1192B	ğ‘¤«	11900..1195F	Dives Akuru	Dives akuru letter ssa		
U+1192C	ğ‘¤¬	11900..1195F	Dives Akuru	Dives akuru letter sa		
U+1192D	ğ‘¤­	11900..1195F	Dives Akuru	Dives akuru letter ha		
U+1192E	ğ‘¤®	11900..1195F	Dives Akuru	Dives akuru letter lla		
U+1192F	ğ‘¤¯	11900..1195F	Dives Akuru	Dives akuru letter za		
U+11930	ğ‘¤°	11900..1195F	Dives Akuru	Dives akuru vowel sign aa		
U+11931	ğ‘¤±	11900..1195F	Dives Akuru	Dives akuru vowel sign i		
U+11932	ğ‘¤²	11900..1195F	Dives Akuru	Dives akuru vowel sign ii		
U+11933	ğ‘¤³	11900..1195F	Dives Akuru	Dives akuru vowel sign u		
U+11934	ğ‘¤´	11900..1195F	Dives Akuru	Dives akuru vowel sign uu		
U+11935	ğ‘¤µ	11900..1195F	Dives Akuru	Dives akuru vowel sign e		
U+11937	ğ‘¤·	11900..1195F	Dives Akuru	Dives akuru vowel sign ai		
U+11938	ğ‘¤¸	11900..1195F	Dives Akuru	Dives akuru vowel sign o		
U+1193B	ğ‘¤»	11900..1195F	Dives Akuru	Dives akuru sign anusvara		
U+1193C	ğ‘¤¼	11900..1195F	Dives Akuru	Dives akuru sign candrabindu		
U+1193D	ğ‘¤½	11900..1195F	Dives Akuru	Dives akuru sign halanta		
U+1193E	ğ‘¤¾	11900..1195F	Dives Akuru	Dives akuru virama		
U+1193F	ğ‘¤¿	11900..1195F	Dives Akuru	Dives akuru prefixed nasal sign		
U+11940	ğ‘¥€	11900..1195F	Dives Akuru	Dives akuru medial ya		
U+11941	ğ‘¥	11900..1195F	Dives Akuru	Dives akuru initial ra		
U+11942	ğ‘¥‚	11900..1195F	Dives Akuru	Dives akuru medial ra		
U+11943	ğ‘¥ƒ	11900..1195F	Dives Akuru	Dives akuru sign nukta		
U+11944	ğ‘¥„	11900..1195F	Dives Akuru	Dives akuru double danda		
U+11945	ğ‘¥…	11900..1195F	Dives Akuru	Dives akuru gap filler		
U+11946	ğ‘¥†	11900..1195F	Dives Akuru	Dives akuru end of text mark		
U+11950	ğ‘¥	11900..1195F	Dives Akuru	Dives akuru digit zero		
U+11951	ğ‘¥‘	11900..1195F	Dives Akuru	Dives akuru digit one		
U+11952	ğ‘¥’	11900..1195F	Dives Akuru	Dives akuru digit two		
U+11953	ğ‘¥“	11900..1195F	Dives Akuru	Dives akuru digit three		
U+11954	ğ‘¥”	11900..1195F	Dives Akuru	Dives akuru digit four		
U+11955	ğ‘¥•	11900..1195F	Dives Akuru	Dives akuru digit five		
U+11956	ğ‘¥–	11900..1195F	Dives Akuru	Dives akuru digit six		
U+11957	ğ‘¥—	11900..1195F	Dives Akuru	Dives akuru digit seven		
U+11958	ğ‘¥˜	11900..1195F	Dives Akuru	Dives akuru digit eight		
U+11959	ğ‘¥™	11900..1195F	Dives Akuru	Dives akuru digit nine		
