code_point	symbol	block	block_name	name	tab_completion	latex_code
U+12000	ğ’€€	12000..123FF	Cuneiform	Cuneiform sign a		
U+12001	ğ’€	12000..123FF	Cuneiform	Cuneiform sign a times a		
U+12002	ğ’€‚	12000..123FF	Cuneiform	Cuneiform sign a times bad		
U+12003	ğ’€ƒ	12000..123FF	Cuneiform	Cuneiform sign a times gan2 tenu		
U+12004	ğ’€„	12000..123FF	Cuneiform	Cuneiform sign a times ha		
U+12005	ğ’€…	12000..123FF	Cuneiform	Cuneiform sign a times igi		
U+12006	ğ’€†	12000..123FF	Cuneiform	Cuneiform sign a times lagar gunu		
U+12007	ğ’€‡	12000..123FF	Cuneiform	Cuneiform sign a times mush		
U+12008	ğ’€ˆ	12000..123FF	Cuneiform	Cuneiform sign a times sag		
U+12009	ğ’€‰	12000..123FF	Cuneiform	Cuneiform sign a2		
U+1200A	ğ’€Š	12000..123FF	Cuneiform	Cuneiform sign ab		
U+1200B	ğ’€‹	12000..123FF	Cuneiform	Cuneiform sign ab times ash2		
U+1200C	ğ’€Œ	12000..123FF	Cuneiform	Cuneiform sign ab times dun3 gunu		
U+1200D	ğ’€	12000..123FF	Cuneiform	Cuneiform sign ab times gal		
U+1200E	ğ’€	12000..123FF	Cuneiform	Cuneiform sign ab times gan2 tenu		
U+1200F	ğ’€	12000..123FF	Cuneiform	Cuneiform sign ab times ha		
U+12010	ğ’€	12000..123FF	Cuneiform	Cuneiform sign ab times igi gunu		
U+12011	ğ’€‘	12000..123FF	Cuneiform	Cuneiform sign ab times imin		
U+12012	ğ’€’	12000..123FF	Cuneiform	Cuneiform sign ab times lagab		
U+12013	ğ’€“	12000..123FF	Cuneiform	Cuneiform sign ab times shesh		
U+12014	ğ’€”	12000..123FF	Cuneiform	Cuneiform sign ab times u plus u plus u		
U+12015	ğ’€•	12000..123FF	Cuneiform	Cuneiform sign ab gunu		
U+12016	ğ’€–	12000..123FF	Cuneiform	Cuneiform sign ab2		
U+12017	ğ’€—	12000..123FF	Cuneiform	Cuneiform sign ab2 times balag		
U+12018	ğ’€˜	12000..123FF	Cuneiform	Cuneiform sign ab2 times gan2 tenu		
U+12019	ğ’€™	12000..123FF	Cuneiform	Cuneiform sign ab2 times me plus en		
U+1201A	ğ’€š	12000..123FF	Cuneiform	Cuneiform sign ab2 times sha3		
U+1201B	ğ’€›	12000..123FF	Cuneiform	Cuneiform sign ab2 times tak4		
U+1201C	ğ’€œ	12000..123FF	Cuneiform	Cuneiform sign ad		
U+1201D	ğ’€	12000..123FF	Cuneiform	Cuneiform sign ak		
U+1201E	ğ’€	12000..123FF	Cuneiform	Cuneiform sign ak times erin2		
U+1201F	ğ’€Ÿ	12000..123FF	Cuneiform	Cuneiform sign ak times shita plus gish		
U+12020	ğ’€ 	12000..123FF	Cuneiform	Cuneiform sign al		
U+12021	ğ’€¡	12000..123FF	Cuneiform	Cuneiform sign al times al		
U+12022	ğ’€¢	12000..123FF	Cuneiform	Cuneiform sign al times dim2		
U+12023	ğ’€£	12000..123FF	Cuneiform	Cuneiform sign al times gish		
U+12024	ğ’€¤	12000..123FF	Cuneiform	Cuneiform sign al times ha		
U+12025	ğ’€¥	12000..123FF	Cuneiform	Cuneiform sign al times kad3		
U+12026	ğ’€¦	12000..123FF	Cuneiform	Cuneiform sign al times ki		
U+12027	ğ’€§	12000..123FF	Cuneiform	Cuneiform sign al times she		
U+12028	ğ’€¨	12000..123FF	Cuneiform	Cuneiform sign al times ush		
U+12029	ğ’€©	12000..123FF	Cuneiform	Cuneiform sign alan		
U+1202A	ğ’€ª	12000..123FF	Cuneiform	Cuneiform sign aleph		
U+1202B	ğ’€«	12000..123FF	Cuneiform	Cuneiform sign amar		
U+1202C	ğ’€¬	12000..123FF	Cuneiform	Cuneiform sign amar times she		
U+1202D	ğ’€­	12000..123FF	Cuneiform	Cuneiform sign an		
U+1202E	ğ’€®	12000..123FF	Cuneiform	Cuneiform sign an over an		
U+1202F	ğ’€¯	12000..123FF	Cuneiform	Cuneiform sign an three times		
U+12030	ğ’€°	12000..123FF	Cuneiform	Cuneiform sign an plus naga opposing an plus naga		
U+12031	ğ’€±	12000..123FF	Cuneiform	Cuneiform sign an plus naga squared		
U+12032	ğ’€²	12000..123FF	Cuneiform	Cuneiform sign anshe		
U+12033	ğ’€³	12000..123FF	Cuneiform	Cuneiform sign apin		
U+12034	ğ’€´	12000..123FF	Cuneiform	Cuneiform sign arad		
U+12035	ğ’€µ	12000..123FF	Cuneiform	Cuneiform sign arad times kur		
U+12036	ğ’€¶	12000..123FF	Cuneiform	Cuneiform sign arkab		
U+12037	ğ’€·	12000..123FF	Cuneiform	Cuneiform sign asal2		
U+12038	ğ’€¸	12000..123FF	Cuneiform	Cuneiform sign ash		
U+12039	ğ’€¹	12000..123FF	Cuneiform	Cuneiform sign ash zida tenu		
U+1203A	ğ’€º	12000..123FF	Cuneiform	Cuneiform sign ash kaba tenu		
U+1203B	ğ’€»	12000..123FF	Cuneiform	Cuneiform sign ash over ash tug2 over tug2 tug2 over tug2 pap		
U+1203C	ğ’€¼	12000..123FF	Cuneiform	Cuneiform sign ash over ash over ash		
U+1203D	ğ’€½	12000..123FF	Cuneiform	Cuneiform sign ash over ash over ash crossing ash over ash over ash		
U+1203E	ğ’€¾	12000..123FF	Cuneiform	Cuneiform sign ash2		
U+1203F	ğ’€¿	12000..123FF	Cuneiform	Cuneiform sign ashgab		
U+12040	ğ’€	12000..123FF	Cuneiform	Cuneiform sign ba		
U+12041	ğ’	12000..123FF	Cuneiform	Cuneiform sign bad		
U+12042	ğ’‚	12000..123FF	Cuneiform	Cuneiform sign bag3		
U+12043	ğ’ƒ	12000..123FF	Cuneiform	Cuneiform sign bahar2		
U+12044	ğ’„	12000..123FF	Cuneiform	Cuneiform sign bal		
U+12045	ğ’…	12000..123FF	Cuneiform	Cuneiform sign bal over bal		
U+12046	ğ’†	12000..123FF	Cuneiform	Cuneiform sign balag		
U+12047	ğ’‡	12000..123FF	Cuneiform	Cuneiform sign bar		
U+12048	ğ’ˆ	12000..123FF	Cuneiform	Cuneiform sign bara2		
U+12049	ğ’‰	12000..123FF	Cuneiform	Cuneiform sign bi		
U+1204A	ğ’Š	12000..123FF	Cuneiform	Cuneiform sign bi times a		
U+1204B	ğ’‹	12000..123FF	Cuneiform	Cuneiform sign bi times gar		
U+1204C	ğ’Œ	12000..123FF	Cuneiform	Cuneiform sign bi times igi gunu		
U+1204D	ğ’	12000..123FF	Cuneiform	Cuneiform sign bu		
U+1204E	ğ’	12000..123FF	Cuneiform	Cuneiform sign bu over bu ab		
U+1204F	ğ’	12000..123FF	Cuneiform	Cuneiform sign bu over bu un		
U+12050	ğ’	12000..123FF	Cuneiform	Cuneiform sign bu crossing bu		
U+12051	ğ’‘	12000..123FF	Cuneiform	Cuneiform sign bulug		
U+12052	ğ’’	12000..123FF	Cuneiform	Cuneiform sign bulug over bulug		
U+12053	ğ’“	12000..123FF	Cuneiform	Cuneiform sign bur		
U+12054	ğ’”	12000..123FF	Cuneiform	Cuneiform sign bur2		
U+12055	ğ’•	12000..123FF	Cuneiform	Cuneiform sign da		
U+12056	ğ’–	12000..123FF	Cuneiform	Cuneiform sign dag		
U+12057	ğ’—	12000..123FF	Cuneiform	Cuneiform sign dag kisim5 times a plus mash		
U+12058	ğ’˜	12000..123FF	Cuneiform	Cuneiform sign dag kisim5 times amar		
U+12059	ğ’™	12000..123FF	Cuneiform	Cuneiform sign dag kisim5 times balag		
U+1205A	ğ’š	12000..123FF	Cuneiform	Cuneiform sign dag kisim5 times bi		
U+1205B	ğ’›	12000..123FF	Cuneiform	Cuneiform sign dag kisim5 times ga		
U+1205C	ğ’œ	12000..123FF	Cuneiform	Cuneiform sign dag kisim5 times ga plus mash		
U+1205D	ğ’	12000..123FF	Cuneiform	Cuneiform sign dag kisim5 times gi		
U+1205E	ğ’	12000..123FF	Cuneiform	Cuneiform sign dag kisim5 times gir2		
U+1205F	ğ’Ÿ	12000..123FF	Cuneiform	Cuneiform sign dag kisim5 times gud		
U+12060	ğ’ 	12000..123FF	Cuneiform	Cuneiform sign dag kisim5 times ha		
U+12061	ğ’¡	12000..123FF	Cuneiform	Cuneiform sign dag kisim5 times ir		
U+12062	ğ’¢	12000..123FF	Cuneiform	Cuneiform sign dag kisim5 times ir plus lu		
U+12063	ğ’£	12000..123FF	Cuneiform	Cuneiform sign dag kisim5 times kak		
U+12064	ğ’¤	12000..123FF	Cuneiform	Cuneiform sign dag kisim5 times la		
U+12065	ğ’¥	12000..123FF	Cuneiform	Cuneiform sign dag kisim5 times lu		
U+12066	ğ’¦	12000..123FF	Cuneiform	Cuneiform sign dag kisim5 times lu plus mash2		
U+12067	ğ’§	12000..123FF	Cuneiform	Cuneiform sign dag kisim5 times lum		
U+12068	ğ’¨	12000..123FF	Cuneiform	Cuneiform sign dag kisim5 times ne		
U+12069	ğ’©	12000..123FF	Cuneiform	Cuneiform sign dag kisim5 times pap plus pap		
U+1206A	ğ’ª	12000..123FF	Cuneiform	Cuneiform sign dag kisim5 times si		
U+1206B	ğ’«	12000..123FF	Cuneiform	Cuneiform sign dag kisim5 times tak4		
U+1206C	ğ’¬	12000..123FF	Cuneiform	Cuneiform sign dag kisim5 times u2 plus gir2		
U+1206D	ğ’­	12000..123FF	Cuneiform	Cuneiform sign dag kisim5 times ush		
U+1206E	ğ’®	12000..123FF	Cuneiform	Cuneiform sign dam		
U+1206F	ğ’¯	12000..123FF	Cuneiform	Cuneiform sign dar		
U+12070	ğ’°	12000..123FF	Cuneiform	Cuneiform sign dara3		
U+12071	ğ’±	12000..123FF	Cuneiform	Cuneiform sign dara4		
U+12072	ğ’²	12000..123FF	Cuneiform	Cuneiform sign di		
U+12073	ğ’³	12000..123FF	Cuneiform	Cuneiform sign dib		
U+12074	ğ’´	12000..123FF	Cuneiform	Cuneiform sign dim		
U+12075	ğ’µ	12000..123FF	Cuneiform	Cuneiform sign dim times she		
U+12076	ğ’¶	12000..123FF	Cuneiform	Cuneiform sign dim2		
U+12077	ğ’·	12000..123FF	Cuneiform	Cuneiform sign din		
U+12078	ğ’¸	12000..123FF	Cuneiform	Cuneiform sign din kaskal u gunu dish		
U+12079	ğ’¹	12000..123FF	Cuneiform	Cuneiform sign dish		
U+1207A	ğ’º	12000..123FF	Cuneiform	Cuneiform sign du		
U+1207B	ğ’»	12000..123FF	Cuneiform	Cuneiform sign du over du		
U+1207C	ğ’¼	12000..123FF	Cuneiform	Cuneiform sign du gunu		
U+1207D	ğ’½	12000..123FF	Cuneiform	Cuneiform sign du sheshig		
U+1207E	ğ’¾	12000..123FF	Cuneiform	Cuneiform sign dub		
U+1207F	ğ’¿	12000..123FF	Cuneiform	Cuneiform sign dub times esh2		
U+12080	ğ’‚€	12000..123FF	Cuneiform	Cuneiform sign dub2		
U+12081	ğ’‚	12000..123FF	Cuneiform	Cuneiform sign dug		
U+12082	ğ’‚‚	12000..123FF	Cuneiform	Cuneiform sign dugud		
U+12083	ğ’‚ƒ	12000..123FF	Cuneiform	Cuneiform sign duh		
U+12084	ğ’‚„	12000..123FF	Cuneiform	Cuneiform sign dun		
U+12085	ğ’‚…	12000..123FF	Cuneiform	Cuneiform sign dun3		
U+12086	ğ’‚†	12000..123FF	Cuneiform	Cuneiform sign dun3 gunu		
U+12087	ğ’‚‡	12000..123FF	Cuneiform	Cuneiform sign dun3 gunu gunu		
U+12088	ğ’‚ˆ	12000..123FF	Cuneiform	Cuneiform sign dun4		
U+12089	ğ’‚‰	12000..123FF	Cuneiform	Cuneiform sign dur2		
U+1208A	ğ’‚Š	12000..123FF	Cuneiform	Cuneiform sign e		
U+1208B	ğ’‚‹	12000..123FF	Cuneiform	Cuneiform sign e times pap		
U+1208C	ğ’‚Œ	12000..123FF	Cuneiform	Cuneiform sign e over e nun over nun		
U+1208D	ğ’‚	12000..123FF	Cuneiform	Cuneiform sign e2		
U+1208E	ğ’‚	12000..123FF	Cuneiform	Cuneiform sign e2 times a plus ha plus da		
U+1208F	ğ’‚	12000..123FF	Cuneiform	Cuneiform sign e2 times gar		
U+12090	ğ’‚	12000..123FF	Cuneiform	Cuneiform sign e2 times mi		
U+12091	ğ’‚‘	12000..123FF	Cuneiform	Cuneiform sign e2 times sal		
U+12092	ğ’‚’	12000..123FF	Cuneiform	Cuneiform sign e2 times she		
U+12093	ğ’‚“	12000..123FF	Cuneiform	Cuneiform sign e2 times u		
U+12094	ğ’‚”	12000..123FF	Cuneiform	Cuneiform sign edin		
U+12095	ğ’‚•	12000..123FF	Cuneiform	Cuneiform sign egir		
U+12096	ğ’‚–	12000..123FF	Cuneiform	Cuneiform sign el		
U+12097	ğ’‚—	12000..123FF	Cuneiform	Cuneiform sign en		
U+12098	ğ’‚˜	12000..123FF	Cuneiform	Cuneiform sign en times gan2		
U+12099	ğ’‚™	12000..123FF	Cuneiform	Cuneiform sign en times gan2 tenu		
U+1209A	ğ’‚š	12000..123FF	Cuneiform	Cuneiform sign en times me		
U+1209B	ğ’‚›	12000..123FF	Cuneiform	Cuneiform sign en crossing en		
U+1209C	ğ’‚œ	12000..123FF	Cuneiform	Cuneiform sign en opposing en		
U+1209D	ğ’‚	12000..123FF	Cuneiform	Cuneiform sign en squared		
U+1209E	ğ’‚	12000..123FF	Cuneiform	Cuneiform sign eren		
U+1209F	ğ’‚Ÿ	12000..123FF	Cuneiform	Cuneiform sign erin2		
U+120A0	ğ’‚ 	12000..123FF	Cuneiform	Cuneiform sign esh2		
U+120A1	ğ’‚¡	12000..123FF	Cuneiform	Cuneiform sign ezen		
U+120A2	ğ’‚¢	12000..123FF	Cuneiform	Cuneiform sign ezen times a		
U+120A3	ğ’‚£	12000..123FF	Cuneiform	Cuneiform sign ezen times a plus lal		
U+120A4	ğ’‚¤	12000..123FF	Cuneiform	Cuneiform sign ezen times a plus lal times lal		
U+120A5	ğ’‚¥	12000..123FF	Cuneiform	Cuneiform sign ezen times an		
U+120A6	ğ’‚¦	12000..123FF	Cuneiform	Cuneiform sign ezen times bad		
U+120A7	ğ’‚§	12000..123FF	Cuneiform	Cuneiform sign ezen times dun3 gunu		
U+120A8	ğ’‚¨	12000..123FF	Cuneiform	Cuneiform sign ezen times dun3 gunu gunu		
U+120A9	ğ’‚©	12000..123FF	Cuneiform	Cuneiform sign ezen times ha		
U+120AA	ğ’‚ª	12000..123FF	Cuneiform	Cuneiform sign ezen times ha gunu		
U+120AB	ğ’‚«	12000..123FF	Cuneiform	Cuneiform sign ezen times igi gunu		
U+120AC	ğ’‚¬	12000..123FF	Cuneiform	Cuneiform sign ezen times kaskal		
U+120AD	ğ’‚­	12000..123FF	Cuneiform	Cuneiform sign ezen times kaskal squared		
U+120AE	ğ’‚®	12000..123FF	Cuneiform	Cuneiform sign ezen times ku3		
U+120AF	ğ’‚¯	12000..123FF	Cuneiform	Cuneiform sign ezen times la		
U+120B0	ğ’‚°	12000..123FF	Cuneiform	Cuneiform sign ezen times lal times lal		
U+120B1	ğ’‚±	12000..123FF	Cuneiform	Cuneiform sign ezen times li		
U+120B2	ğ’‚²	12000..123FF	Cuneiform	Cuneiform sign ezen times lu		
U+120B3	ğ’‚³	12000..123FF	Cuneiform	Cuneiform sign ezen times u2		
U+120B4	ğ’‚´	12000..123FF	Cuneiform	Cuneiform sign ezen times ud		
U+120B5	ğ’‚µ	12000..123FF	Cuneiform	Cuneiform sign ga		
U+120B6	ğ’‚¶	12000..123FF	Cuneiform	Cuneiform sign ga gunu		
U+120B7	ğ’‚·	12000..123FF	Cuneiform	Cuneiform sign ga2		
U+120B8	ğ’‚¸	12000..123FF	Cuneiform	Cuneiform sign ga2 times a plus da plus ha		
U+120B9	ğ’‚¹	12000..123FF	Cuneiform	Cuneiform sign ga2 times a plus ha		
U+120BA	ğ’‚º	12000..123FF	Cuneiform	Cuneiform sign ga2 times a plus igi		
U+120BB	ğ’‚»	12000..123FF	Cuneiform	Cuneiform sign ga2 times ab2 tenu plus tab		
U+120BC	ğ’‚¼	12000..123FF	Cuneiform	Cuneiform sign ga2 times an		
U+120BD	ğ’‚½	12000..123FF	Cuneiform	Cuneiform sign ga2 times ash		
U+120BE	ğ’‚¾	12000..123FF	Cuneiform	Cuneiform sign ga2 times ash2 plus gal		
U+120BF	ğ’‚¿	12000..123FF	Cuneiform	Cuneiform sign ga2 times bad		
U+120C0	ğ’ƒ€	12000..123FF	Cuneiform	Cuneiform sign ga2 times bar plus ra		
U+120C1	ğ’ƒ	12000..123FF	Cuneiform	Cuneiform sign ga2 times bur		
U+120C2	ğ’ƒ‚	12000..123FF	Cuneiform	Cuneiform sign ga2 times bur plus ra		
U+120C3	ğ’ƒƒ	12000..123FF	Cuneiform	Cuneiform sign ga2 times da		
U+120C4	ğ’ƒ„	12000..123FF	Cuneiform	Cuneiform sign ga2 times di		
U+120C5	ğ’ƒ…	12000..123FF	Cuneiform	Cuneiform sign ga2 times dim times she		
U+120C6	ğ’ƒ†	12000..123FF	Cuneiform	Cuneiform sign ga2 times dub		
U+120C7	ğ’ƒ‡	12000..123FF	Cuneiform	Cuneiform sign ga2 times el		
U+120C8	ğ’ƒˆ	12000..123FF	Cuneiform	Cuneiform sign ga2 times el plus la		
U+120C9	ğ’ƒ‰	12000..123FF	Cuneiform	Cuneiform sign ga2 times en		
U+120CA	ğ’ƒŠ	12000..123FF	Cuneiform	Cuneiform sign ga2 times en times gan2 tenu		
U+120CB	ğ’ƒ‹	12000..123FF	Cuneiform	Cuneiform sign ga2 times gan2 tenu		
U+120CC	ğ’ƒŒ	12000..123FF	Cuneiform	Cuneiform sign ga2 times gar		
U+120CD	ğ’ƒ	12000..123FF	Cuneiform	Cuneiform sign ga2 times gi		
U+120CE	ğ’ƒ	12000..123FF	Cuneiform	Cuneiform sign ga2 times gi4		
U+120CF	ğ’ƒ	12000..123FF	Cuneiform	Cuneiform sign ga2 times gi4 plus a		
U+120D0	ğ’ƒ	12000..123FF	Cuneiform	Cuneiform sign ga2 times gir2 plus su		
U+120D1	ğ’ƒ‘	12000..123FF	Cuneiform	Cuneiform sign ga2 times ha plus lu plus esh2		
U+120D2	ğ’ƒ’	12000..123FF	Cuneiform	Cuneiform sign ga2 times hal		
U+120D3	ğ’ƒ“	12000..123FF	Cuneiform	Cuneiform sign ga2 times hal plus la		
U+120D4	ğ’ƒ”	12000..123FF	Cuneiform	Cuneiform sign ga2 times hi plus li		
U+120D5	ğ’ƒ•	12000..123FF	Cuneiform	Cuneiform sign ga2 times hub2		
U+120D6	ğ’ƒ–	12000..123FF	Cuneiform	Cuneiform sign ga2 times igi gunu		
U+120D7	ğ’ƒ—	12000..123FF	Cuneiform	Cuneiform sign ga2 times ish plus hu plus ash		
U+120D8	ğ’ƒ˜	12000..123FF	Cuneiform	Cuneiform sign ga2 times kak		
U+120D9	ğ’ƒ™	12000..123FF	Cuneiform	Cuneiform sign ga2 times kaskal		
U+120DA	ğ’ƒš	12000..123FF	Cuneiform	Cuneiform sign ga2 times kid		
U+120DB	ğ’ƒ›	12000..123FF	Cuneiform	Cuneiform sign ga2 times kid plus lal		
U+120DC	ğ’ƒœ	12000..123FF	Cuneiform	Cuneiform sign ga2 times ku3 plus an		
U+120DD	ğ’ƒ	12000..123FF	Cuneiform	Cuneiform sign ga2 times la		
U+120DE	ğ’ƒ	12000..123FF	Cuneiform	Cuneiform sign ga2 times me plus en		
U+120DF	ğ’ƒŸ	12000..123FF	Cuneiform	Cuneiform sign ga2 times mi		
U+120E0	ğ’ƒ 	12000..123FF	Cuneiform	Cuneiform sign ga2 times nun		
U+120E1	ğ’ƒ¡	12000..123FF	Cuneiform	Cuneiform sign ga2 times nun over nun		
U+120E2	ğ’ƒ¢	12000..123FF	Cuneiform	Cuneiform sign ga2 times pa		
U+120E3	ğ’ƒ£	12000..123FF	Cuneiform	Cuneiform sign ga2 times sal		
U+120E4	ğ’ƒ¤	12000..123FF	Cuneiform	Cuneiform sign ga2 times sar		
U+120E5	ğ’ƒ¥	12000..123FF	Cuneiform	Cuneiform sign ga2 times she		
U+120E6	ğ’ƒ¦	12000..123FF	Cuneiform	Cuneiform sign ga2 times she plus tur		
U+120E7	ğ’ƒ§	12000..123FF	Cuneiform	Cuneiform sign ga2 times shid		
U+120E8	ğ’ƒ¨	12000..123FF	Cuneiform	Cuneiform sign ga2 times sum		
U+120E9	ğ’ƒ©	12000..123FF	Cuneiform	Cuneiform sign ga2 times tak4		
U+120EA	ğ’ƒª	12000..123FF	Cuneiform	Cuneiform sign ga2 times u		
U+120EB	ğ’ƒ«	12000..123FF	Cuneiform	Cuneiform sign ga2 times ud		
U+120EC	ğ’ƒ¬	12000..123FF	Cuneiform	Cuneiform sign ga2 times ud plus du		
U+120ED	ğ’ƒ­	12000..123FF	Cuneiform	Cuneiform sign ga2 over ga2		
U+120EE	ğ’ƒ®	12000..123FF	Cuneiform	Cuneiform sign gaba		
U+120EF	ğ’ƒ¯	12000..123FF	Cuneiform	Cuneiform sign gaba crossing gaba		
U+120F0	ğ’ƒ°	12000..123FF	Cuneiform	Cuneiform sign gad		
U+120F1	ğ’ƒ±	12000..123FF	Cuneiform	Cuneiform sign gad over gad gar over gar		
U+120F2	ğ’ƒ²	12000..123FF	Cuneiform	Cuneiform sign gal		
U+120F3	ğ’ƒ³	12000..123FF	Cuneiform	Cuneiform sign gal gad over gad gar over gar		
U+120F4	ğ’ƒ´	12000..123FF	Cuneiform	Cuneiform sign galam		
U+120F5	ğ’ƒµ	12000..123FF	Cuneiform	Cuneiform sign gam		
U+120F6	ğ’ƒ¶	12000..123FF	Cuneiform	Cuneiform sign gan		
U+120F7	ğ’ƒ·	12000..123FF	Cuneiform	Cuneiform sign gan2		
U+120F8	ğ’ƒ¸	12000..123FF	Cuneiform	Cuneiform sign gan2 tenu		
U+120F9	ğ’ƒ¹	12000..123FF	Cuneiform	Cuneiform sign gan2 over gan2		
U+120FA	ğ’ƒº	12000..123FF	Cuneiform	Cuneiform sign gan2 crossing gan2		
U+120FB	ğ’ƒ»	12000..123FF	Cuneiform	Cuneiform sign gar		
U+120FC	ğ’ƒ¼	12000..123FF	Cuneiform	Cuneiform sign gar3		
U+120FD	ğ’ƒ½	12000..123FF	Cuneiform	Cuneiform sign gashan		
U+120FE	ğ’ƒ¾	12000..123FF	Cuneiform	Cuneiform sign geshtin		
U+120FF	ğ’ƒ¿	12000..123FF	Cuneiform	Cuneiform sign geshtin times kur		
U+12100	ğ’„€	12000..123FF	Cuneiform	Cuneiform sign gi		
U+12101	ğ’„	12000..123FF	Cuneiform	Cuneiform sign gi times e		
U+12102	ğ’„‚	12000..123FF	Cuneiform	Cuneiform sign gi times u		
U+12103	ğ’„ƒ	12000..123FF	Cuneiform	Cuneiform sign gi crossing gi		
U+12104	ğ’„„	12000..123FF	Cuneiform	Cuneiform sign gi4		
U+12105	ğ’„…	12000..123FF	Cuneiform	Cuneiform sign gi4 over gi4		
U+12106	ğ’„†	12000..123FF	Cuneiform	Cuneiform sign gi4 crossing gi4		
U+12107	ğ’„‡	12000..123FF	Cuneiform	Cuneiform sign gidim		
U+12108	ğ’„ˆ	12000..123FF	Cuneiform	Cuneiform sign gir2		
U+12109	ğ’„‰	12000..123FF	Cuneiform	Cuneiform sign gir2 gunu		
U+1210A	ğ’„Š	12000..123FF	Cuneiform	Cuneiform sign gir3		
U+1210B	ğ’„‹	12000..123FF	Cuneiform	Cuneiform sign gir3 times a plus igi		
U+1210C	ğ’„Œ	12000..123FF	Cuneiform	Cuneiform sign gir3 times gan2 tenu		
U+1210D	ğ’„	12000..123FF	Cuneiform	Cuneiform sign gir3 times igi		
U+1210E	ğ’„	12000..123FF	Cuneiform	Cuneiform sign gir3 times lu plus igi		
U+1210F	ğ’„	12000..123FF	Cuneiform	Cuneiform sign gir3 times pa		
U+12110	ğ’„	12000..123FF	Cuneiform	Cuneiform sign gisal		
U+12111	ğ’„‘	12000..123FF	Cuneiform	Cuneiform sign gish		
U+12112	ğ’„’	12000..123FF	Cuneiform	Cuneiform sign gish crossing gish		
U+12113	ğ’„“	12000..123FF	Cuneiform	Cuneiform sign gish times bad		
U+12114	ğ’„”	12000..123FF	Cuneiform	Cuneiform sign gish times tak4		
U+12115	ğ’„•	12000..123FF	Cuneiform	Cuneiform sign gish tenu		
U+12116	ğ’„–	12000..123FF	Cuneiform	Cuneiform sign gu		
U+12117	ğ’„—	12000..123FF	Cuneiform	Cuneiform sign gu crossing gu		
U+12118	ğ’„˜	12000..123FF	Cuneiform	Cuneiform sign gu2		
U+12119	ğ’„™	12000..123FF	Cuneiform	Cuneiform sign gu2 times kak		
U+1211A	ğ’„š	12000..123FF	Cuneiform	Cuneiform sign gu2 times kak times igi gunu		
U+1211B	ğ’„›	12000..123FF	Cuneiform	Cuneiform sign gu2 times nun		
U+1211C	ğ’„œ	12000..123FF	Cuneiform	Cuneiform sign gu2 times sal plus tug2		
U+1211D	ğ’„	12000..123FF	Cuneiform	Cuneiform sign gu2 gunu		
U+1211E	ğ’„	12000..123FF	Cuneiform	Cuneiform sign gud		
U+1211F	ğ’„Ÿ	12000..123FF	Cuneiform	Cuneiform sign gud times a plus kur		
U+12120	ğ’„ 	12000..123FF	Cuneiform	Cuneiform sign gud times kur		
U+12121	ğ’„¡	12000..123FF	Cuneiform	Cuneiform sign gud over gud lugal		
U+12122	ğ’„¢	12000..123FF	Cuneiform	Cuneiform sign gul		
U+12123	ğ’„£	12000..123FF	Cuneiform	Cuneiform sign gum		
U+12124	ğ’„¤	12000..123FF	Cuneiform	Cuneiform sign gum times she		
U+12125	ğ’„¥	12000..123FF	Cuneiform	Cuneiform sign gur		
U+12126	ğ’„¦	12000..123FF	Cuneiform	Cuneiform sign gur7		
U+12127	ğ’„§	12000..123FF	Cuneiform	Cuneiform sign gurun		
U+12128	ğ’„¨	12000..123FF	Cuneiform	Cuneiform sign gurush		
U+12129	ğ’„©	12000..123FF	Cuneiform	Cuneiform sign ha		
U+1212A	ğ’„ª	12000..123FF	Cuneiform	Cuneiform sign ha tenu		
U+1212B	ğ’„«	12000..123FF	Cuneiform	Cuneiform sign ha gunu		
U+1212C	ğ’„¬	12000..123FF	Cuneiform	Cuneiform sign hal		
U+1212D	ğ’„­	12000..123FF	Cuneiform	Cuneiform sign hi		
U+1212E	ğ’„®	12000..123FF	Cuneiform	Cuneiform sign hi times ash		
U+1212F	ğ’„¯	12000..123FF	Cuneiform	Cuneiform sign hi times ash2		
U+12130	ğ’„°	12000..123FF	Cuneiform	Cuneiform sign hi times bad		
U+12131	ğ’„±	12000..123FF	Cuneiform	Cuneiform sign hi times dish		
U+12132	ğ’„²	12000..123FF	Cuneiform	Cuneiform sign hi times gad		
U+12133	ğ’„³	12000..123FF	Cuneiform	Cuneiform sign hi times kin		
U+12134	ğ’„´	12000..123FF	Cuneiform	Cuneiform sign hi times nun		
U+12135	ğ’„µ	12000..123FF	Cuneiform	Cuneiform sign hi times she		
U+12136	ğ’„¶	12000..123FF	Cuneiform	Cuneiform sign hi times u		
U+12137	ğ’„·	12000..123FF	Cuneiform	Cuneiform sign hu		
U+12138	ğ’„¸	12000..123FF	Cuneiform	Cuneiform sign hub2		
U+12139	ğ’„¹	12000..123FF	Cuneiform	Cuneiform sign hub2 times an		
U+1213A	ğ’„º	12000..123FF	Cuneiform	Cuneiform sign hub2 times hal		
U+1213B	ğ’„»	12000..123FF	Cuneiform	Cuneiform sign hub2 times kaskal		
U+1213C	ğ’„¼	12000..123FF	Cuneiform	Cuneiform sign hub2 times lish		
U+1213D	ğ’„½	12000..123FF	Cuneiform	Cuneiform sign hub2 times ud		
U+1213E	ğ’„¾	12000..123FF	Cuneiform	Cuneiform sign hul2		
U+1213F	ğ’„¿	12000..123FF	Cuneiform	Cuneiform sign i		
U+12140	ğ’…€	12000..123FF	Cuneiform	Cuneiform sign i a		
U+12141	ğ’…	12000..123FF	Cuneiform	Cuneiform sign ib		
U+12142	ğ’…‚	12000..123FF	Cuneiform	Cuneiform sign idim		
U+12143	ğ’…ƒ	12000..123FF	Cuneiform	Cuneiform sign idim over idim bur		
U+12144	ğ’…„	12000..123FF	Cuneiform	Cuneiform sign idim over idim squared		
U+12145	ğ’……	12000..123FF	Cuneiform	Cuneiform sign ig		
U+12146	ğ’…†	12000..123FF	Cuneiform	Cuneiform sign igi		
U+12147	ğ’…‡	12000..123FF	Cuneiform	Cuneiform sign igi dib		
U+12148	ğ’…ˆ	12000..123FF	Cuneiform	Cuneiform sign igi ri		
U+12149	ğ’…‰	12000..123FF	Cuneiform	Cuneiform sign igi over igi shir over shir ud over ud		
U+1214A	ğ’…Š	12000..123FF	Cuneiform	Cuneiform sign igi gunu		
U+1214B	ğ’…‹	12000..123FF	Cuneiform	Cuneiform sign il		
U+1214C	ğ’…Œ	12000..123FF	Cuneiform	Cuneiform sign il times gan2 tenu		
U+1214D	ğ’…	12000..123FF	Cuneiform	Cuneiform sign il2		
U+1214E	ğ’…	12000..123FF	Cuneiform	Cuneiform sign im		
U+1214F	ğ’…	12000..123FF	Cuneiform	Cuneiform sign im times tak4		
U+12150	ğ’…	12000..123FF	Cuneiform	Cuneiform sign im crossing im		
U+12151	ğ’…‘	12000..123FF	Cuneiform	Cuneiform sign im opposing im		
U+12152	ğ’…’	12000..123FF	Cuneiform	Cuneiform sign im squared		
U+12153	ğ’…“	12000..123FF	Cuneiform	Cuneiform sign imin		
U+12154	ğ’…”	12000..123FF	Cuneiform	Cuneiform sign in		
U+12155	ğ’…•	12000..123FF	Cuneiform	Cuneiform sign ir		
U+12156	ğ’…–	12000..123FF	Cuneiform	Cuneiform sign ish		
U+12157	ğ’…—	12000..123FF	Cuneiform	Cuneiform sign ka		
U+12158	ğ’…˜	12000..123FF	Cuneiform	Cuneiform sign ka times a		
U+12159	ğ’…™	12000..123FF	Cuneiform	Cuneiform sign ka times ad		
U+1215A	ğ’…š	12000..123FF	Cuneiform	Cuneiform sign ka times ad plus ku3		
U+1215B	ğ’…›	12000..123FF	Cuneiform	Cuneiform sign ka times ash2		
U+1215C	ğ’…œ	12000..123FF	Cuneiform	Cuneiform sign ka times bad		
U+1215D	ğ’…	12000..123FF	Cuneiform	Cuneiform sign ka times balag		
U+1215E	ğ’…	12000..123FF	Cuneiform	Cuneiform sign ka times bar		
U+1215F	ğ’…Ÿ	12000..123FF	Cuneiform	Cuneiform sign ka times bi		
U+12160	ğ’… 	12000..123FF	Cuneiform	Cuneiform sign ka times erin2		
U+12161	ğ’…¡	12000..123FF	Cuneiform	Cuneiform sign ka times esh2		
U+12162	ğ’…¢	12000..123FF	Cuneiform	Cuneiform sign ka times ga		
U+12163	ğ’…£	12000..123FF	Cuneiform	Cuneiform sign ka times gal		
U+12164	ğ’…¤	12000..123FF	Cuneiform	Cuneiform sign ka times gan2 tenu		
U+12165	ğ’…¥	12000..123FF	Cuneiform	Cuneiform sign ka times gar		
U+12166	ğ’…¦	12000..123FF	Cuneiform	Cuneiform sign ka times gar plus sha3 plus a		
U+12167	ğ’…§	12000..123FF	Cuneiform	Cuneiform sign ka times gi		
U+12168	ğ’…¨	12000..123FF	Cuneiform	Cuneiform sign ka times gir2		
U+12169	ğ’…©	12000..123FF	Cuneiform	Cuneiform sign ka times gish plus sar		
