code_point	symbol	block	block_name	name	tab_completion	latex_code
U+1216A	ğ’…ª	12000..123FF	Cuneiform	Cuneiform sign ka times gish crossing gish		
U+1216B	ğ’…«	12000..123FF	Cuneiform	Cuneiform sign ka times gu		
U+1216C	ğ’…¬	12000..123FF	Cuneiform	Cuneiform sign ka times gur7		
U+1216D	ğ’…­	12000..123FF	Cuneiform	Cuneiform sign ka times igi		
U+1216E	ğ’…®	12000..123FF	Cuneiform	Cuneiform sign ka times im		
U+1216F	ğ’…¯	12000..123FF	Cuneiform	Cuneiform sign ka times kak		
U+12170	ğ’…°	12000..123FF	Cuneiform	Cuneiform sign ka times ki		
U+12171	ğ’…±	12000..123FF	Cuneiform	Cuneiform sign ka times kid		
U+12172	ğ’…²	12000..123FF	Cuneiform	Cuneiform sign ka times li		
U+12173	ğ’…³	12000..123FF	Cuneiform	Cuneiform sign ka times lu		
U+12174	ğ’…´	12000..123FF	Cuneiform	Cuneiform sign ka times me		
U+12175	ğ’…µ	12000..123FF	Cuneiform	Cuneiform sign ka times me plus du		
U+12176	ğ’…¶	12000..123FF	Cuneiform	Cuneiform sign ka times me plus gi		
U+12177	ğ’…·	12000..123FF	Cuneiform	Cuneiform sign ka times me plus te		
U+12178	ğ’…¸	12000..123FF	Cuneiform	Cuneiform sign ka times mi		
U+12179	ğ’…¹	12000..123FF	Cuneiform	Cuneiform sign ka times mi plus nunuz		
U+1217A	ğ’…º	12000..123FF	Cuneiform	Cuneiform sign ka times ne		
U+1217B	ğ’…»	12000..123FF	Cuneiform	Cuneiform sign ka times nun		
U+1217C	ğ’…¼	12000..123FF	Cuneiform	Cuneiform sign ka times pi		
U+1217D	ğ’…½	12000..123FF	Cuneiform	Cuneiform sign ka times ru		
U+1217E	ğ’…¾	12000..123FF	Cuneiform	Cuneiform sign ka times sa		
U+1217F	ğ’…¿	12000..123FF	Cuneiform	Cuneiform sign ka times sar		
U+12180	ğ’†€	12000..123FF	Cuneiform	Cuneiform sign ka times sha		
U+12181	ğ’†	12000..123FF	Cuneiform	Cuneiform sign ka times she		
U+12182	ğ’†‚	12000..123FF	Cuneiform	Cuneiform sign ka times shid		
U+12183	ğ’†ƒ	12000..123FF	Cuneiform	Cuneiform sign ka times shu		
U+12184	ğ’†„	12000..123FF	Cuneiform	Cuneiform sign ka times sig		
U+12185	ğ’†…	12000..123FF	Cuneiform	Cuneiform sign ka times suhur		
U+12186	ğ’††	12000..123FF	Cuneiform	Cuneiform sign ka times tar		
U+12187	ğ’†‡	12000..123FF	Cuneiform	Cuneiform sign ka times u		
U+12188	ğ’†ˆ	12000..123FF	Cuneiform	Cuneiform sign ka times u2		
U+12189	ğ’†‰	12000..123FF	Cuneiform	Cuneiform sign ka times ud		
U+1218A	ğ’†Š	12000..123FF	Cuneiform	Cuneiform sign ka times umum times pa		
U+1218B	ğ’†‹	12000..123FF	Cuneiform	Cuneiform sign ka times ush		
U+1218C	ğ’†Œ	12000..123FF	Cuneiform	Cuneiform sign ka times zi		
U+1218D	ğ’†	12000..123FF	Cuneiform	Cuneiform sign ka2		
U+1218E	ğ’†	12000..123FF	Cuneiform	Cuneiform sign ka2 crossing ka2		
U+1218F	ğ’†	12000..123FF	Cuneiform	Cuneiform sign kab		
U+12190	ğ’†	12000..123FF	Cuneiform	Cuneiform sign kad2		
U+12191	ğ’†‘	12000..123FF	Cuneiform	Cuneiform sign kad3		
U+12192	ğ’†’	12000..123FF	Cuneiform	Cuneiform sign kad4		
U+12193	ğ’†“	12000..123FF	Cuneiform	Cuneiform sign kad5		
U+12194	ğ’†”	12000..123FF	Cuneiform	Cuneiform sign kad5 over kad5		
U+12195	ğ’†•	12000..123FF	Cuneiform	Cuneiform sign kak		
U+12196	ğ’†–	12000..123FF	Cuneiform	Cuneiform sign kak times igi gunu		
U+12197	ğ’†—	12000..123FF	Cuneiform	Cuneiform sign kal		
U+12198	ğ’†˜	12000..123FF	Cuneiform	Cuneiform sign kal times bad		
U+12199	ğ’†™	12000..123FF	Cuneiform	Cuneiform sign kal crossing kal		
U+1219A	ğ’†š	12000..123FF	Cuneiform	Cuneiform sign kam2		
U+1219B	ğ’†›	12000..123FF	Cuneiform	Cuneiform sign kam4		
U+1219C	ğ’†œ	12000..123FF	Cuneiform	Cuneiform sign kaskal		
U+1219D	ğ’†	12000..123FF	Cuneiform	Cuneiform sign kaskal lagab times u over lagab times u		
U+1219E	ğ’†	12000..123FF	Cuneiform	Cuneiform sign kaskal over kaskal lagab times u over lagab times u		
U+1219F	ğ’†Ÿ	12000..123FF	Cuneiform	Cuneiform sign kesh2		
U+121A0	ğ’† 	12000..123FF	Cuneiform	Cuneiform sign ki		
U+121A1	ğ’†¡	12000..123FF	Cuneiform	Cuneiform sign ki times bad		
U+121A2	ğ’†¢	12000..123FF	Cuneiform	Cuneiform sign ki times u		
U+121A3	ğ’†£	12000..123FF	Cuneiform	Cuneiform sign ki times ud		
U+121A4	ğ’†¤	12000..123FF	Cuneiform	Cuneiform sign kid		
U+121A5	ğ’†¥	12000..123FF	Cuneiform	Cuneiform sign kin		
U+121A6	ğ’†¦	12000..123FF	Cuneiform	Cuneiform sign kisal		
U+121A7	ğ’†§	12000..123FF	Cuneiform	Cuneiform sign kish		
U+121A8	ğ’†¨	12000..123FF	Cuneiform	Cuneiform sign kisim5		
U+121A9	ğ’†©	12000..123FF	Cuneiform	Cuneiform sign kisim5 over kisim5		
U+121AA	ğ’†ª	12000..123FF	Cuneiform	Cuneiform sign ku		
U+121AB	ğ’†«	12000..123FF	Cuneiform	Cuneiform sign ku over hi times ash2 ku over hi times ash2		
U+121AC	ğ’†¬	12000..123FF	Cuneiform	Cuneiform sign ku3		
U+121AD	ğ’†­	12000..123FF	Cuneiform	Cuneiform sign ku4		
U+121AE	ğ’†®	12000..123FF	Cuneiform	Cuneiform sign ku4 variant form		
U+121AF	ğ’†¯	12000..123FF	Cuneiform	Cuneiform sign ku7		
U+121B0	ğ’†°	12000..123FF	Cuneiform	Cuneiform sign kul		
U+121B1	ğ’†±	12000..123FF	Cuneiform	Cuneiform sign kul gunu		
U+121B2	ğ’†²	12000..123FF	Cuneiform	Cuneiform sign kun		
U+121B3	ğ’†³	12000..123FF	Cuneiform	Cuneiform sign kur		
U+121B4	ğ’†´	12000..123FF	Cuneiform	Cuneiform sign kur opposing kur		
U+121B5	ğ’†µ	12000..123FF	Cuneiform	Cuneiform sign kushu2		
U+121B6	ğ’†¶	12000..123FF	Cuneiform	Cuneiform sign kwu318		
U+121B7	ğ’†·	12000..123FF	Cuneiform	Cuneiform sign la		
U+121B8	ğ’†¸	12000..123FF	Cuneiform	Cuneiform sign lagab		
U+121B9	ğ’†¹	12000..123FF	Cuneiform	Cuneiform sign lagab times a		
U+121BA	ğ’†º	12000..123FF	Cuneiform	Cuneiform sign lagab times a plus da plus ha		
U+121BB	ğ’†»	12000..123FF	Cuneiform	Cuneiform sign lagab times a plus gar		
U+121BC	ğ’†¼	12000..123FF	Cuneiform	Cuneiform sign lagab times a plus lal		
U+121BD	ğ’†½	12000..123FF	Cuneiform	Cuneiform sign lagab times al		
U+121BE	ğ’†¾	12000..123FF	Cuneiform	Cuneiform sign lagab times an		
U+121BF	ğ’†¿	12000..123FF	Cuneiform	Cuneiform sign lagab times ash zida tenu		
U+121C0	ğ’‡€	12000..123FF	Cuneiform	Cuneiform sign lagab times bad		
U+121C1	ğ’‡	12000..123FF	Cuneiform	Cuneiform sign lagab times bi		
U+121C2	ğ’‡‚	12000..123FF	Cuneiform	Cuneiform sign lagab times dar		
U+121C3	ğ’‡ƒ	12000..123FF	Cuneiform	Cuneiform sign lagab times en		
U+121C4	ğ’‡„	12000..123FF	Cuneiform	Cuneiform sign lagab times ga		
U+121C5	ğ’‡…	12000..123FF	Cuneiform	Cuneiform sign lagab times gar		
U+121C6	ğ’‡†	12000..123FF	Cuneiform	Cuneiform sign lagab times gud		
U+121C7	ğ’‡‡	12000..123FF	Cuneiform	Cuneiform sign lagab times gud plus gud		
U+121C8	ğ’‡ˆ	12000..123FF	Cuneiform	Cuneiform sign lagab times ha		
U+121C9	ğ’‡‰	12000..123FF	Cuneiform	Cuneiform sign lagab times hal		
U+121CA	ğ’‡Š	12000..123FF	Cuneiform	Cuneiform sign lagab times hi times nun		
U+121CB	ğ’‡‹	12000..123FF	Cuneiform	Cuneiform sign lagab times igi gunu		
U+121CC	ğ’‡Œ	12000..123FF	Cuneiform	Cuneiform sign lagab times im		
U+121CD	ğ’‡	12000..123FF	Cuneiform	Cuneiform sign lagab times im plus ha		
U+121CE	ğ’‡	12000..123FF	Cuneiform	Cuneiform sign lagab times im plus lu		
U+121CF	ğ’‡	12000..123FF	Cuneiform	Cuneiform sign lagab times ki		
U+121D0	ğ’‡	12000..123FF	Cuneiform	Cuneiform sign lagab times kin		
U+121D1	ğ’‡‘	12000..123FF	Cuneiform	Cuneiform sign lagab times ku3		
U+121D2	ğ’‡’	12000..123FF	Cuneiform	Cuneiform sign lagab times kul		
U+121D3	ğ’‡“	12000..123FF	Cuneiform	Cuneiform sign lagab times kul plus hi plus a		
U+121D4	ğ’‡”	12000..123FF	Cuneiform	Cuneiform sign lagab times lagab		
U+121D5	ğ’‡•	12000..123FF	Cuneiform	Cuneiform sign lagab times lish		
U+121D6	ğ’‡–	12000..123FF	Cuneiform	Cuneiform sign lagab times lu		
U+121D7	ğ’‡—	12000..123FF	Cuneiform	Cuneiform sign lagab times lul		
U+121D8	ğ’‡˜	12000..123FF	Cuneiform	Cuneiform sign lagab times me		
U+121D9	ğ’‡™	12000..123FF	Cuneiform	Cuneiform sign lagab times me plus en		
U+121DA	ğ’‡š	12000..123FF	Cuneiform	Cuneiform sign lagab times mush		
U+121DB	ğ’‡›	12000..123FF	Cuneiform	Cuneiform sign lagab times ne		
U+121DC	ğ’‡œ	12000..123FF	Cuneiform	Cuneiform sign lagab times she plus sum		
U+121DD	ğ’‡	12000..123FF	Cuneiform	Cuneiform sign lagab times shita plus gish plus erin2		
U+121DE	ğ’‡	12000..123FF	Cuneiform	Cuneiform sign lagab times shita plus gish tenu		
U+121DF	ğ’‡Ÿ	12000..123FF	Cuneiform	Cuneiform sign lagab times shu2		
U+121E0	ğ’‡ 	12000..123FF	Cuneiform	Cuneiform sign lagab times shu2 plus shu2		
U+121E1	ğ’‡¡	12000..123FF	Cuneiform	Cuneiform sign lagab times sum		
U+121E2	ğ’‡¢	12000..123FF	Cuneiform	Cuneiform sign lagab times tag		
U+121E3	ğ’‡£	12000..123FF	Cuneiform	Cuneiform sign lagab times tak4		
U+121E4	ğ’‡¤	12000..123FF	Cuneiform	Cuneiform sign lagab times te plus a plus su plus na		
U+121E5	ğ’‡¥	12000..123FF	Cuneiform	Cuneiform sign lagab times u		
U+121E6	ğ’‡¦	12000..123FF	Cuneiform	Cuneiform sign lagab times u plus a		
U+121E7	ğ’‡§	12000..123FF	Cuneiform	Cuneiform sign lagab times u plus u plus u		
U+121E8	ğ’‡¨	12000..123FF	Cuneiform	Cuneiform sign lagab times u2 plus ash		
U+121E9	ğ’‡©	12000..123FF	Cuneiform	Cuneiform sign lagab times ud		
U+121EA	ğ’‡ª	12000..123FF	Cuneiform	Cuneiform sign lagab times ush		
U+121EB	ğ’‡«	12000..123FF	Cuneiform	Cuneiform sign lagab squared		
U+121EC	ğ’‡¬	12000..123FF	Cuneiform	Cuneiform sign lagar		
U+121ED	ğ’‡­	12000..123FF	Cuneiform	Cuneiform sign lagar times she		
U+121EE	ğ’‡®	12000..123FF	Cuneiform	Cuneiform sign lagar times she plus sum		
U+121EF	ğ’‡¯	12000..123FF	Cuneiform	Cuneiform sign lagar gunu		
U+121F0	ğ’‡°	12000..123FF	Cuneiform	Cuneiform sign lagar gunu over lagar gunu she		
U+121F1	ğ’‡±	12000..123FF	Cuneiform	Cuneiform sign lahshu		
U+121F2	ğ’‡²	12000..123FF	Cuneiform	Cuneiform sign lal		
U+121F3	ğ’‡³	12000..123FF	Cuneiform	Cuneiform sign lal times lal		
U+121F4	ğ’‡´	12000..123FF	Cuneiform	Cuneiform sign lam		
U+121F5	ğ’‡µ	12000..123FF	Cuneiform	Cuneiform sign lam times kur		
U+121F6	ğ’‡¶	12000..123FF	Cuneiform	Cuneiform sign lam times kur plus ru		
U+121F7	ğ’‡·	12000..123FF	Cuneiform	Cuneiform sign li		
U+121F8	ğ’‡¸	12000..123FF	Cuneiform	Cuneiform sign lil		
U+121F9	ğ’‡¹	12000..123FF	Cuneiform	Cuneiform sign limmu2		
U+121FA	ğ’‡º	12000..123FF	Cuneiform	Cuneiform sign lish		
U+121FB	ğ’‡»	12000..123FF	Cuneiform	Cuneiform sign lu		
U+121FC	ğ’‡¼	12000..123FF	Cuneiform	Cuneiform sign lu times bad		
U+121FD	ğ’‡½	12000..123FF	Cuneiform	Cuneiform sign lu2		
U+121FE	ğ’‡¾	12000..123FF	Cuneiform	Cuneiform sign lu2 times al		
U+121FF	ğ’‡¿	12000..123FF	Cuneiform	Cuneiform sign lu2 times bad		
U+12200	ğ’ˆ€	12000..123FF	Cuneiform	Cuneiform sign lu2 times esh2		
U+12201	ğ’ˆ	12000..123FF	Cuneiform	Cuneiform sign lu2 times esh2 tenu		
U+12202	ğ’ˆ‚	12000..123FF	Cuneiform	Cuneiform sign lu2 times gan2 tenu		
U+12203	ğ’ˆƒ	12000..123FF	Cuneiform	Cuneiform sign lu2 times hi times bad		
U+12204	ğ’ˆ„	12000..123FF	Cuneiform	Cuneiform sign lu2 times im		
U+12205	ğ’ˆ…	12000..123FF	Cuneiform	Cuneiform sign lu2 times kad2		
U+12206	ğ’ˆ†	12000..123FF	Cuneiform	Cuneiform sign lu2 times kad3		
U+12207	ğ’ˆ‡	12000..123FF	Cuneiform	Cuneiform sign lu2 times kad3 plus ash		
U+12208	ğ’ˆˆ	12000..123FF	Cuneiform	Cuneiform sign lu2 times ki		
U+12209	ğ’ˆ‰	12000..123FF	Cuneiform	Cuneiform sign lu2 times la plus ash		
U+1220A	ğ’ˆŠ	12000..123FF	Cuneiform	Cuneiform sign lu2 times lagab		
U+1220B	ğ’ˆ‹	12000..123FF	Cuneiform	Cuneiform sign lu2 times me plus en		
U+1220C	ğ’ˆŒ	12000..123FF	Cuneiform	Cuneiform sign lu2 times ne		
U+1220D	ğ’ˆ	12000..123FF	Cuneiform	Cuneiform sign lu2 times nu		
U+1220E	ğ’ˆ	12000..123FF	Cuneiform	Cuneiform sign lu2 times si plus ash		
U+1220F	ğ’ˆ	12000..123FF	Cuneiform	Cuneiform sign lu2 times sik2 plus bu		
U+12210	ğ’ˆ	12000..123FF	Cuneiform	Cuneiform sign lu2 times tug2		
U+12211	ğ’ˆ‘	12000..123FF	Cuneiform	Cuneiform sign lu2 tenu		
U+12212	ğ’ˆ’	12000..123FF	Cuneiform	Cuneiform sign lu2 crossing lu2		
U+12213	ğ’ˆ“	12000..123FF	Cuneiform	Cuneiform sign lu2 opposing lu2		
U+12214	ğ’ˆ”	12000..123FF	Cuneiform	Cuneiform sign lu2 squared		
U+12215	ğ’ˆ•	12000..123FF	Cuneiform	Cuneiform sign lu2 sheshig		
U+12216	ğ’ˆ–	12000..123FF	Cuneiform	Cuneiform sign lu3		
U+12217	ğ’ˆ—	12000..123FF	Cuneiform	Cuneiform sign lugal		
U+12218	ğ’ˆ˜	12000..123FF	Cuneiform	Cuneiform sign lugal over lugal		
U+12219	ğ’ˆ™	12000..123FF	Cuneiform	Cuneiform sign lugal opposing lugal		
U+1221A	ğ’ˆš	12000..123FF	Cuneiform	Cuneiform sign lugal sheshig		
U+1221B	ğ’ˆ›	12000..123FF	Cuneiform	Cuneiform sign luh		
U+1221C	ğ’ˆœ	12000..123FF	Cuneiform	Cuneiform sign lul		
U+1221D	ğ’ˆ	12000..123FF	Cuneiform	Cuneiform sign lum		
U+1221E	ğ’ˆ	12000..123FF	Cuneiform	Cuneiform sign lum over lum		
U+1221F	ğ’ˆŸ	12000..123FF	Cuneiform	Cuneiform sign lum over lum gar over gar		
U+12220	ğ’ˆ 	12000..123FF	Cuneiform	Cuneiform sign ma		
U+12221	ğ’ˆ¡	12000..123FF	Cuneiform	Cuneiform sign ma times tak4		
U+12222	ğ’ˆ¢	12000..123FF	Cuneiform	Cuneiform sign ma gunu		
U+12223	ğ’ˆ£	12000..123FF	Cuneiform	Cuneiform sign ma2		
U+12224	ğ’ˆ¤	12000..123FF	Cuneiform	Cuneiform sign mah		
U+12225	ğ’ˆ¥	12000..123FF	Cuneiform	Cuneiform sign mar		
U+12226	ğ’ˆ¦	12000..123FF	Cuneiform	Cuneiform sign mash		
U+12227	ğ’ˆ§	12000..123FF	Cuneiform	Cuneiform sign mash2		
U+12228	ğ’ˆ¨	12000..123FF	Cuneiform	Cuneiform sign me		
U+12229	ğ’ˆ©	12000..123FF	Cuneiform	Cuneiform sign mes		
U+1222A	ğ’ˆª	12000..123FF	Cuneiform	Cuneiform sign mi		
U+1222B	ğ’ˆ«	12000..123FF	Cuneiform	Cuneiform sign min		
U+1222C	ğ’ˆ¬	12000..123FF	Cuneiform	Cuneiform sign mu		
U+1222D	ğ’ˆ­	12000..123FF	Cuneiform	Cuneiform sign mu over mu		
U+1222E	ğ’ˆ®	12000..123FF	Cuneiform	Cuneiform sign mug		
U+1222F	ğ’ˆ¯	12000..123FF	Cuneiform	Cuneiform sign mug gunu		
U+12230	ğ’ˆ°	12000..123FF	Cuneiform	Cuneiform sign munsub		
U+12231	ğ’ˆ±	12000..123FF	Cuneiform	Cuneiform sign murgu2		
U+12232	ğ’ˆ²	12000..123FF	Cuneiform	Cuneiform sign mush		
U+12233	ğ’ˆ³	12000..123FF	Cuneiform	Cuneiform sign mush times a		
U+12234	ğ’ˆ´	12000..123FF	Cuneiform	Cuneiform sign mush times kur		
U+12235	ğ’ˆµ	12000..123FF	Cuneiform	Cuneiform sign mush times za		
U+12236	ğ’ˆ¶	12000..123FF	Cuneiform	Cuneiform sign mush over mush		
U+12237	ğ’ˆ·	12000..123FF	Cuneiform	Cuneiform sign mush over mush times a plus na		
U+12238	ğ’ˆ¸	12000..123FF	Cuneiform	Cuneiform sign mush crossing mush		
U+12239	ğ’ˆ¹	12000..123FF	Cuneiform	Cuneiform sign mush3		
U+1223A	ğ’ˆº	12000..123FF	Cuneiform	Cuneiform sign mush3 times a		
U+1223B	ğ’ˆ»	12000..123FF	Cuneiform	Cuneiform sign mush3 times a plus di		
U+1223C	ğ’ˆ¼	12000..123FF	Cuneiform	Cuneiform sign mush3 times di		
U+1223D	ğ’ˆ½	12000..123FF	Cuneiform	Cuneiform sign mush3 gunu		
U+1223E	ğ’ˆ¾	12000..123FF	Cuneiform	Cuneiform sign na		
U+1223F	ğ’ˆ¿	12000..123FF	Cuneiform	Cuneiform sign na2		
U+12240	ğ’‰€	12000..123FF	Cuneiform	Cuneiform sign naga		
U+12241	ğ’‰	12000..123FF	Cuneiform	Cuneiform sign naga inverted		
U+12242	ğ’‰‚	12000..123FF	Cuneiform	Cuneiform sign naga times shu tenu		
U+12243	ğ’‰ƒ	12000..123FF	Cuneiform	Cuneiform sign naga opposing naga		
U+12244	ğ’‰„	12000..123FF	Cuneiform	Cuneiform sign nagar		
U+12245	ğ’‰…	12000..123FF	Cuneiform	Cuneiform sign nam nutillu		
U+12246	ğ’‰†	12000..123FF	Cuneiform	Cuneiform sign nam		
U+12247	ğ’‰‡	12000..123FF	Cuneiform	Cuneiform sign nam2		
U+12248	ğ’‰ˆ	12000..123FF	Cuneiform	Cuneiform sign ne		
U+12249	ğ’‰‰	12000..123FF	Cuneiform	Cuneiform sign ne times a		
U+1224A	ğ’‰Š	12000..123FF	Cuneiform	Cuneiform sign ne times ud		
U+1224B	ğ’‰‹	12000..123FF	Cuneiform	Cuneiform sign ne sheshig		
U+1224C	ğ’‰Œ	12000..123FF	Cuneiform	Cuneiform sign ni		
U+1224D	ğ’‰	12000..123FF	Cuneiform	Cuneiform sign ni times e		
U+1224E	ğ’‰	12000..123FF	Cuneiform	Cuneiform sign ni2		
U+1224F	ğ’‰	12000..123FF	Cuneiform	Cuneiform sign nim		
U+12250	ğ’‰	12000..123FF	Cuneiform	Cuneiform sign nim times gan2 tenu		
U+12251	ğ’‰‘	12000..123FF	Cuneiform	Cuneiform sign nim times gar plus gan2 tenu		
U+12252	ğ’‰’	12000..123FF	Cuneiform	Cuneiform sign ninda2		
U+12253	ğ’‰“	12000..123FF	Cuneiform	Cuneiform sign ninda2 times an		
U+12254	ğ’‰”	12000..123FF	Cuneiform	Cuneiform sign ninda2 times ash		
U+12255	ğ’‰•	12000..123FF	Cuneiform	Cuneiform sign ninda2 times ash plus ash		
U+12256	ğ’‰–	12000..123FF	Cuneiform	Cuneiform sign ninda2 times gud		
U+12257	ğ’‰—	12000..123FF	Cuneiform	Cuneiform sign ninda2 times me plus gan2 tenu		
U+12258	ğ’‰˜	12000..123FF	Cuneiform	Cuneiform sign ninda2 times ne		
U+12259	ğ’‰™	12000..123FF	Cuneiform	Cuneiform sign ninda2 times nun		
U+1225A	ğ’‰š	12000..123FF	Cuneiform	Cuneiform sign ninda2 times she		
U+1225B	ğ’‰›	12000..123FF	Cuneiform	Cuneiform sign ninda2 times she plus a an		
U+1225C	ğ’‰œ	12000..123FF	Cuneiform	Cuneiform sign ninda2 times she plus ash		
U+1225D	ğ’‰	12000..123FF	Cuneiform	Cuneiform sign ninda2 times she plus ash plus ash		
U+1225E	ğ’‰	12000..123FF	Cuneiform	Cuneiform sign ninda2 times u2 plus ash		
U+1225F	ğ’‰Ÿ	12000..123FF	Cuneiform	Cuneiform sign ninda2 times ush		
U+12260	ğ’‰ 	12000..123FF	Cuneiform	Cuneiform sign nisag		
U+12261	ğ’‰¡	12000..123FF	Cuneiform	Cuneiform sign nu		
U+12262	ğ’‰¢	12000..123FF	Cuneiform	Cuneiform sign nu11		
U+12263	ğ’‰£	12000..123FF	Cuneiform	Cuneiform sign nun		
U+12264	ğ’‰¤	12000..123FF	Cuneiform	Cuneiform sign nun lagar times gar		
U+12265	ğ’‰¥	12000..123FF	Cuneiform	Cuneiform sign nun lagar times mash		
U+12266	ğ’‰¦	12000..123FF	Cuneiform	Cuneiform sign nun lagar times sal		
U+12267	ğ’‰§	12000..123FF	Cuneiform	Cuneiform sign nun lagar times sal over nun lagar times sal		
U+12268	ğ’‰¨	12000..123FF	Cuneiform	Cuneiform sign nun lagar times ush		
U+12269	ğ’‰©	12000..123FF	Cuneiform	Cuneiform sign nun tenu		
U+1226A	ğ’‰ª	12000..123FF	Cuneiform	Cuneiform sign nun over nun		
U+1226B	ğ’‰«	12000..123FF	Cuneiform	Cuneiform sign nun crossing nun		
U+1226C	ğ’‰¬	12000..123FF	Cuneiform	Cuneiform sign nun crossing nun lagar over lagar		
U+1226D	ğ’‰­	12000..123FF	Cuneiform	Cuneiform sign nunuz		
U+1226E	ğ’‰®	12000..123FF	Cuneiform	Cuneiform sign nunuz ab2 times ashgab		
U+1226F	ğ’‰¯	12000..123FF	Cuneiform	Cuneiform sign nunuz ab2 times bi		
U+12270	ğ’‰°	12000..123FF	Cuneiform	Cuneiform sign nunuz ab2 times dug		
U+12271	ğ’‰±	12000..123FF	Cuneiform	Cuneiform sign nunuz ab2 times gud		
U+12272	ğ’‰²	12000..123FF	Cuneiform	Cuneiform sign nunuz ab2 times igi gunu		
U+12273	ğ’‰³	12000..123FF	Cuneiform	Cuneiform sign nunuz ab2 times kad3		
U+12274	ğ’‰´	12000..123FF	Cuneiform	Cuneiform sign nunuz ab2 times la		
U+12275	ğ’‰µ	12000..123FF	Cuneiform	Cuneiform sign nunuz ab2 times ne		
U+12276	ğ’‰¶	12000..123FF	Cuneiform	Cuneiform sign nunuz ab2 times sila3		
U+12277	ğ’‰·	12000..123FF	Cuneiform	Cuneiform sign nunuz ab2 times u2		
U+12278	ğ’‰¸	12000..123FF	Cuneiform	Cuneiform sign nunuz kisim5 times bi		
U+12279	ğ’‰¹	12000..123FF	Cuneiform	Cuneiform sign nunuz kisim5 times bi u		
U+1227A	ğ’‰º	12000..123FF	Cuneiform	Cuneiform sign pa		
U+1227B	ğ’‰»	12000..123FF	Cuneiform	Cuneiform sign pad		
U+1227C	ğ’‰¼	12000..123FF	Cuneiform	Cuneiform sign pan		
U+1227D	ğ’‰½	12000..123FF	Cuneiform	Cuneiform sign pap		
U+1227E	ğ’‰¾	12000..123FF	Cuneiform	Cuneiform sign pesh2		
U+1227F	ğ’‰¿	12000..123FF	Cuneiform	Cuneiform sign pi		
U+12280	ğ’Š€	12000..123FF	Cuneiform	Cuneiform sign pi times a		
U+12281	ğ’Š	12000..123FF	Cuneiform	Cuneiform sign pi times ab		
U+12282	ğ’Š‚	12000..123FF	Cuneiform	Cuneiform sign pi times bi		
U+12283	ğ’Šƒ	12000..123FF	Cuneiform	Cuneiform sign pi times bu		
U+12284	ğ’Š„	12000..123FF	Cuneiform	Cuneiform sign pi times e		
U+12285	ğ’Š…	12000..123FF	Cuneiform	Cuneiform sign pi times i		
U+12286	ğ’Š†	12000..123FF	Cuneiform	Cuneiform sign pi times ib		
U+12287	ğ’Š‡	12000..123FF	Cuneiform	Cuneiform sign pi times u		
U+12288	ğ’Šˆ	12000..123FF	Cuneiform	Cuneiform sign pi times u2		
U+12289	ğ’Š‰	12000..123FF	Cuneiform	Cuneiform sign pi crossing pi		
U+1228A	ğ’ŠŠ	12000..123FF	Cuneiform	Cuneiform sign pirig		
U+1228B	ğ’Š‹	12000..123FF	Cuneiform	Cuneiform sign pirig times kal		
U+1228C	ğ’ŠŒ	12000..123FF	Cuneiform	Cuneiform sign pirig times ud		
U+1228D	ğ’Š	12000..123FF	Cuneiform	Cuneiform sign pirig times za		
U+1228E	ğ’Š	12000..123FF	Cuneiform	Cuneiform sign pirig opposing pirig		
U+1228F	ğ’Š	12000..123FF	Cuneiform	Cuneiform sign ra		
U+12290	ğ’Š	12000..123FF	Cuneiform	Cuneiform sign rab		
U+12291	ğ’Š‘	12000..123FF	Cuneiform	Cuneiform sign ri		
U+12292	ğ’Š’	12000..123FF	Cuneiform	Cuneiform sign ru		
U+12293	ğ’Š“	12000..123FF	Cuneiform	Cuneiform sign sa		
U+12294	ğ’Š”	12000..123FF	Cuneiform	Cuneiform sign sag nutillu		
U+12295	ğ’Š•	12000..123FF	Cuneiform	Cuneiform sign sag		
U+12296	ğ’Š–	12000..123FF	Cuneiform	Cuneiform sign sag times a		
U+12297	ğ’Š—	12000..123FF	Cuneiform	Cuneiform sign sag times du		
U+12298	ğ’Š˜	12000..123FF	Cuneiform	Cuneiform sign sag times dub		
U+12299	ğ’Š™	12000..123FF	Cuneiform	Cuneiform sign sag times ha		
U+1229A	ğ’Šš	12000..123FF	Cuneiform	Cuneiform sign sag times kak		
U+1229B	ğ’Š›	12000..123FF	Cuneiform	Cuneiform sign sag times kur		
U+1229C	ğ’Šœ	12000..123FF	Cuneiform	Cuneiform sign sag times lum		
U+1229D	ğ’Š	12000..123FF	Cuneiform	Cuneiform sign sag times mi		
U+1229E	ğ’Š	12000..123FF	Cuneiform	Cuneiform sign sag times nun		
U+1229F	ğ’ŠŸ	12000..123FF	Cuneiform	Cuneiform sign sag times sal		
U+122A0	ğ’Š 	12000..123FF	Cuneiform	Cuneiform sign sag times shid		
U+122A1	ğ’Š¡	12000..123FF	Cuneiform	Cuneiform sign sag times tab		
U+122A2	ğ’Š¢	12000..123FF	Cuneiform	Cuneiform sign sag times u2		
U+122A3	ğ’Š£	12000..123FF	Cuneiform	Cuneiform sign sag times ub		
U+122A4	ğ’Š¤	12000..123FF	Cuneiform	Cuneiform sign sag times um		
U+122A5	ğ’Š¥	12000..123FF	Cuneiform	Cuneiform sign sag times ur		
U+122A6	ğ’Š¦	12000..123FF	Cuneiform	Cuneiform sign sag times ush		
U+122A7	ğ’Š§	12000..123FF	Cuneiform	Cuneiform sign sag over sag		
U+122A8	ğ’Š¨	12000..123FF	Cuneiform	Cuneiform sign sag gunu		
U+122A9	ğ’Š©	12000..123FF	Cuneiform	Cuneiform sign sal		
U+122AA	ğ’Šª	12000..123FF	Cuneiform	Cuneiform sign sal lagab times ash2		
U+122AB	ğ’Š«	12000..123FF	Cuneiform	Cuneiform sign sanga2		
U+122AC	ğ’Š¬	12000..123FF	Cuneiform	Cuneiform sign sar		
U+122AD	ğ’Š­	12000..123FF	Cuneiform	Cuneiform sign sha		
U+122AE	ğ’Š®	12000..123FF	Cuneiform	Cuneiform sign sha3		
U+122AF	ğ’Š¯	12000..123FF	Cuneiform	Cuneiform sign sha3 times a		
U+122B0	ğ’Š°	12000..123FF	Cuneiform	Cuneiform sign sha3 times bad		
U+122B1	ğ’Š±	12000..123FF	Cuneiform	Cuneiform sign sha3 times gish		
U+122B2	ğ’Š²	12000..123FF	Cuneiform	Cuneiform sign sha3 times ne		
U+122B3	ğ’Š³	12000..123FF	Cuneiform	Cuneiform sign sha3 times shu2		
U+122B4	ğ’Š´	12000..123FF	Cuneiform	Cuneiform sign sha3 times tur		
U+122B5	ğ’Šµ	12000..123FF	Cuneiform	Cuneiform sign sha3 times u		
U+122B6	ğ’Š¶	12000..123FF	Cuneiform	Cuneiform sign sha3 times u plus a		
U+122B7	ğ’Š·	12000..123FF	Cuneiform	Cuneiform sign sha6		
U+122B8	ğ’Š¸	12000..123FF	Cuneiform	Cuneiform sign shab6		
U+122B9	ğ’Š¹	12000..123FF	Cuneiform	Cuneiform sign shar2		
U+122BA	ğ’Šº	12000..123FF	Cuneiform	Cuneiform sign she		
U+122BB	ğ’Š»	12000..123FF	Cuneiform	Cuneiform sign she hu		
U+122BC	ğ’Š¼	12000..123FF	Cuneiform	Cuneiform sign she over she gad over gad gar over gar		
U+122BD	ğ’Š½	12000..123FF	Cuneiform	Cuneiform sign she over she tab over tab gar over gar		
U+122BE	ğ’Š¾	12000..123FF	Cuneiform	Cuneiform sign sheg9		
U+122BF	ğ’Š¿	12000..123FF	Cuneiform	Cuneiform sign shen		
U+122C0	ğ’‹€	12000..123FF	Cuneiform	Cuneiform sign shesh		
U+122C1	ğ’‹	12000..123FF	Cuneiform	Cuneiform sign shesh2		
U+122C2	ğ’‹‚	12000..123FF	Cuneiform	Cuneiform sign sheshlam		
U+122C3	ğ’‹ƒ	12000..123FF	Cuneiform	Cuneiform sign shid		
U+122C4	ğ’‹„	12000..123FF	Cuneiform	Cuneiform sign shid times a		
U+122C5	ğ’‹…	12000..123FF	Cuneiform	Cuneiform sign shid times im		
U+122C6	ğ’‹†	12000..123FF	Cuneiform	Cuneiform sign shim		
U+122C7	ğ’‹‡	12000..123FF	Cuneiform	Cuneiform sign shim times a		
U+122C8	ğ’‹ˆ	12000..123FF	Cuneiform	Cuneiform sign shim times bal		
U+122C9	ğ’‹‰	12000..123FF	Cuneiform	Cuneiform sign shim times bulug		
U+122CA	ğ’‹Š	12000..123FF	Cuneiform	Cuneiform sign shim times din		
U+122CB	ğ’‹‹	12000..123FF	Cuneiform	Cuneiform sign shim times gar		
U+122CC	ğ’‹Œ	12000..123FF	Cuneiform	Cuneiform sign shim times igi		
U+122CD	ğ’‹	12000..123FF	Cuneiform	Cuneiform sign shim times igi gunu		
U+122CE	ğ’‹	12000..123FF	Cuneiform	Cuneiform sign shim times kushu2		
U+122CF	ğ’‹	12000..123FF	Cuneiform	Cuneiform sign shim times lul		
