code_point	symbol	block	block_name	name	tab_completion	latex_code
U+122D0	ğ’‹	12000..123FF	Cuneiform	Cuneiform sign shim times mug		
U+122D1	ğ’‹‘	12000..123FF	Cuneiform	Cuneiform sign shim times sal		
U+122D2	ğ’‹’	12000..123FF	Cuneiform	Cuneiform sign shinig		
U+122D3	ğ’‹“	12000..123FF	Cuneiform	Cuneiform sign shir		
U+122D4	ğ’‹”	12000..123FF	Cuneiform	Cuneiform sign shir tenu		
U+122D5	ğ’‹•	12000..123FF	Cuneiform	Cuneiform sign shir over shir bur over bur		
U+122D6	ğ’‹–	12000..123FF	Cuneiform	Cuneiform sign shita		
U+122D7	ğ’‹—	12000..123FF	Cuneiform	Cuneiform sign shu		
U+122D8	ğ’‹˜	12000..123FF	Cuneiform	Cuneiform sign shu over inverted shu		
U+122D9	ğ’‹™	12000..123FF	Cuneiform	Cuneiform sign shu2		
U+122DA	ğ’‹š	12000..123FF	Cuneiform	Cuneiform sign shubur		
U+122DB	ğ’‹›	12000..123FF	Cuneiform	Cuneiform sign si		
U+122DC	ğ’‹œ	12000..123FF	Cuneiform	Cuneiform sign si gunu		
U+122DD	ğ’‹	12000..123FF	Cuneiform	Cuneiform sign sig		
U+122DE	ğ’‹	12000..123FF	Cuneiform	Cuneiform sign sig4		
U+122DF	ğ’‹Ÿ	12000..123FF	Cuneiform	Cuneiform sign sig4 over sig4 shu2		
U+122E0	ğ’‹ 	12000..123FF	Cuneiform	Cuneiform sign sik2		
U+122E1	ğ’‹¡	12000..123FF	Cuneiform	Cuneiform sign sila3		
U+122E2	ğ’‹¢	12000..123FF	Cuneiform	Cuneiform sign su		
U+122E3	ğ’‹£	12000..123FF	Cuneiform	Cuneiform sign su over su		
U+122E4	ğ’‹¤	12000..123FF	Cuneiform	Cuneiform sign sud		
U+122E5	ğ’‹¥	12000..123FF	Cuneiform	Cuneiform sign sud2		
U+122E6	ğ’‹¦	12000..123FF	Cuneiform	Cuneiform sign suhur		
U+122E7	ğ’‹§	12000..123FF	Cuneiform	Cuneiform sign sum		
U+122E8	ğ’‹¨	12000..123FF	Cuneiform	Cuneiform sign sumash		
U+122E9	ğ’‹©	12000..123FF	Cuneiform	Cuneiform sign sur		
U+122EA	ğ’‹ª	12000..123FF	Cuneiform	Cuneiform sign sur9		
U+122EB	ğ’‹«	12000..123FF	Cuneiform	Cuneiform sign ta		
U+122EC	ğ’‹¬	12000..123FF	Cuneiform	Cuneiform sign ta asterisk		
U+122ED	ğ’‹­	12000..123FF	Cuneiform	Cuneiform sign ta times hi		
U+122EE	ğ’‹®	12000..123FF	Cuneiform	Cuneiform sign ta times mi		
U+122EF	ğ’‹¯	12000..123FF	Cuneiform	Cuneiform sign ta gunu		
U+122F0	ğ’‹°	12000..123FF	Cuneiform	Cuneiform sign tab		
U+122F1	ğ’‹±	12000..123FF	Cuneiform	Cuneiform sign tab over tab ni over ni dish over dish		
U+122F2	ğ’‹²	12000..123FF	Cuneiform	Cuneiform sign tab squared		
U+122F3	ğ’‹³	12000..123FF	Cuneiform	Cuneiform sign tag		
U+122F4	ğ’‹´	12000..123FF	Cuneiform	Cuneiform sign tag times bi		
U+122F5	ğ’‹µ	12000..123FF	Cuneiform	Cuneiform sign tag times gud		
U+122F6	ğ’‹¶	12000..123FF	Cuneiform	Cuneiform sign tag times she		
U+122F7	ğ’‹·	12000..123FF	Cuneiform	Cuneiform sign tag times shu		
U+122F8	ğ’‹¸	12000..123FF	Cuneiform	Cuneiform sign tag times tug2		
U+122F9	ğ’‹¹	12000..123FF	Cuneiform	Cuneiform sign tag times ud		
U+122FA	ğ’‹º	12000..123FF	Cuneiform	Cuneiform sign tak4		
U+122FB	ğ’‹»	12000..123FF	Cuneiform	Cuneiform sign tar		
U+122FC	ğ’‹¼	12000..123FF	Cuneiform	Cuneiform sign te		
U+122FD	ğ’‹½	12000..123FF	Cuneiform	Cuneiform sign te gunu		
U+122FE	ğ’‹¾	12000..123FF	Cuneiform	Cuneiform sign ti		
U+122FF	ğ’‹¿	12000..123FF	Cuneiform	Cuneiform sign ti tenu		
U+12300	ğ’Œ€	12000..123FF	Cuneiform	Cuneiform sign til		
U+12301	ğ’Œ	12000..123FF	Cuneiform	Cuneiform sign tir		
U+12302	ğ’Œ‚	12000..123FF	Cuneiform	Cuneiform sign tir times tak4		
U+12303	ğ’Œƒ	12000..123FF	Cuneiform	Cuneiform sign tir over tir		
U+12304	ğ’Œ„	12000..123FF	Cuneiform	Cuneiform sign tir over tir gad over gad gar over gar		
U+12305	ğ’Œ…	12000..123FF	Cuneiform	Cuneiform sign tu		
U+12306	ğ’Œ†	12000..123FF	Cuneiform	Cuneiform sign tug2		
U+12307	ğ’Œ‡	12000..123FF	Cuneiform	Cuneiform sign tuk		
U+12308	ğ’Œˆ	12000..123FF	Cuneiform	Cuneiform sign tum		
U+12309	ğ’Œ‰	12000..123FF	Cuneiform	Cuneiform sign tur		
U+1230A	ğ’ŒŠ	12000..123FF	Cuneiform	Cuneiform sign tur over tur za over za		
U+1230B	ğ’Œ‹	12000..123FF	Cuneiform	Cuneiform sign u		
U+1230C	ğ’ŒŒ	12000..123FF	Cuneiform	Cuneiform sign u gud		
U+1230D	ğ’Œ	12000..123FF	Cuneiform	Cuneiform sign u u u		
U+1230E	ğ’Œ	12000..123FF	Cuneiform	Cuneiform sign u over u pa over pa gar over gar		
U+1230F	ğ’Œ	12000..123FF	Cuneiform	Cuneiform sign u over u sur over sur		
U+12310	ğ’Œ	12000..123FF	Cuneiform	Cuneiform sign u over u u reversed over u reversed		
U+12311	ğ’Œ‘	12000..123FF	Cuneiform	Cuneiform sign u2		
U+12312	ğ’Œ’	12000..123FF	Cuneiform	Cuneiform sign ub		
U+12313	ğ’Œ“	12000..123FF	Cuneiform	Cuneiform sign ud		
U+12314	ğ’Œ”	12000..123FF	Cuneiform	Cuneiform sign ud kushu2		
U+12315	ğ’Œ•	12000..123FF	Cuneiform	Cuneiform sign ud times bad		
U+12316	ğ’Œ–	12000..123FF	Cuneiform	Cuneiform sign ud times mi		
U+12317	ğ’Œ—	12000..123FF	Cuneiform	Cuneiform sign ud times u plus u plus u		
U+12318	ğ’Œ˜	12000..123FF	Cuneiform	Cuneiform sign ud times u plus u plus u gunu		
U+12319	ğ’Œ™	12000..123FF	Cuneiform	Cuneiform sign ud gunu		
U+1231A	ğ’Œš	12000..123FF	Cuneiform	Cuneiform sign ud sheshig		
U+1231B	ğ’Œ›	12000..123FF	Cuneiform	Cuneiform sign ud sheshig times bad		
U+1231C	ğ’Œœ	12000..123FF	Cuneiform	Cuneiform sign udug		
U+1231D	ğ’Œ	12000..123FF	Cuneiform	Cuneiform sign um		
U+1231E	ğ’Œ	12000..123FF	Cuneiform	Cuneiform sign um times lagab		
U+1231F	ğ’ŒŸ	12000..123FF	Cuneiform	Cuneiform sign um times me plus da		
U+12320	ğ’Œ 	12000..123FF	Cuneiform	Cuneiform sign um times sha3		
U+12321	ğ’Œ¡	12000..123FF	Cuneiform	Cuneiform sign um times u		
U+12322	ğ’Œ¢	12000..123FF	Cuneiform	Cuneiform sign umbin		
U+12323	ğ’Œ£	12000..123FF	Cuneiform	Cuneiform sign umum		
U+12324	ğ’Œ¤	12000..123FF	Cuneiform	Cuneiform sign umum times kaskal		
U+12325	ğ’Œ¥	12000..123FF	Cuneiform	Cuneiform sign umum times pa		
U+12326	ğ’Œ¦	12000..123FF	Cuneiform	Cuneiform sign un		
U+12327	ğ’Œ§	12000..123FF	Cuneiform	Cuneiform sign un gunu		
U+12328	ğ’Œ¨	12000..123FF	Cuneiform	Cuneiform sign ur		
U+12329	ğ’Œ©	12000..123FF	Cuneiform	Cuneiform sign ur crossing ur		
U+1232A	ğ’Œª	12000..123FF	Cuneiform	Cuneiform sign ur sheshig		
U+1232B	ğ’Œ«	12000..123FF	Cuneiform	Cuneiform sign ur2		
U+1232C	ğ’Œ¬	12000..123FF	Cuneiform	Cuneiform sign ur2 times a plus ha		
U+1232D	ğ’Œ­	12000..123FF	Cuneiform	Cuneiform sign ur2 times a plus na		
U+1232E	ğ’Œ®	12000..123FF	Cuneiform	Cuneiform sign ur2 times al		
U+1232F	ğ’Œ¯	12000..123FF	Cuneiform	Cuneiform sign ur2 times ha		
U+12330	ğ’Œ°	12000..123FF	Cuneiform	Cuneiform sign ur2 times nun		
U+12331	ğ’Œ±	12000..123FF	Cuneiform	Cuneiform sign ur2 times u2		
U+12332	ğ’Œ²	12000..123FF	Cuneiform	Cuneiform sign ur2 times u2 plus ash		
U+12333	ğ’Œ³	12000..123FF	Cuneiform	Cuneiform sign ur2 times u2 plus bi		
U+12334	ğ’Œ´	12000..123FF	Cuneiform	Cuneiform sign ur4		
U+12335	ğ’Œµ	12000..123FF	Cuneiform	Cuneiform sign uri		
U+12336	ğ’Œ¶	12000..123FF	Cuneiform	Cuneiform sign uri3		
U+12337	ğ’Œ·	12000..123FF	Cuneiform	Cuneiform sign uru		
U+12338	ğ’Œ¸	12000..123FF	Cuneiform	Cuneiform sign uru times a		
U+12339	ğ’Œ¹	12000..123FF	Cuneiform	Cuneiform sign uru times ashgab		
U+1233A	ğ’Œº	12000..123FF	Cuneiform	Cuneiform sign uru times bar		
U+1233B	ğ’Œ»	12000..123FF	Cuneiform	Cuneiform sign uru times dun		
U+1233C	ğ’Œ¼	12000..123FF	Cuneiform	Cuneiform sign uru times ga		
U+1233D	ğ’Œ½	12000..123FF	Cuneiform	Cuneiform sign uru times gal		
U+1233E	ğ’Œ¾	12000..123FF	Cuneiform	Cuneiform sign uru times gan2 tenu		
U+1233F	ğ’Œ¿	12000..123FF	Cuneiform	Cuneiform sign uru times gar		
U+12340	ğ’€	12000..123FF	Cuneiform	Cuneiform sign uru times gu		
U+12341	ğ’	12000..123FF	Cuneiform	Cuneiform sign uru times ha		
U+12342	ğ’‚	12000..123FF	Cuneiform	Cuneiform sign uru times igi		
U+12343	ğ’ƒ	12000..123FF	Cuneiform	Cuneiform sign uru times im		
U+12344	ğ’„	12000..123FF	Cuneiform	Cuneiform sign uru times ish		
U+12345	ğ’…	12000..123FF	Cuneiform	Cuneiform sign uru times ki		
U+12346	ğ’†	12000..123FF	Cuneiform	Cuneiform sign uru times lum		
U+12347	ğ’‡	12000..123FF	Cuneiform	Cuneiform sign uru times min		
U+12348	ğ’ˆ	12000..123FF	Cuneiform	Cuneiform sign uru times pa		
U+12349	ğ’‰	12000..123FF	Cuneiform	Cuneiform sign uru times she		
U+1234A	ğ’Š	12000..123FF	Cuneiform	Cuneiform sign uru times sig4		
U+1234B	ğ’‹	12000..123FF	Cuneiform	Cuneiform sign uru times tu		
U+1234C	ğ’Œ	12000..123FF	Cuneiform	Cuneiform sign uru times u plus gud		
U+1234D	ğ’	12000..123FF	Cuneiform	Cuneiform sign uru times ud		
U+1234E	ğ’	12000..123FF	Cuneiform	Cuneiform sign uru times uruda		
U+1234F	ğ’	12000..123FF	Cuneiform	Cuneiform sign uruda		
U+12350	ğ’	12000..123FF	Cuneiform	Cuneiform sign uruda times u		
U+12351	ğ’‘	12000..123FF	Cuneiform	Cuneiform sign ush		
U+12352	ğ’’	12000..123FF	Cuneiform	Cuneiform sign ush times a		
U+12353	ğ’“	12000..123FF	Cuneiform	Cuneiform sign ush times ku		
U+12354	ğ’”	12000..123FF	Cuneiform	Cuneiform sign ush times kur		
U+12355	ğ’•	12000..123FF	Cuneiform	Cuneiform sign ush times tak4		
U+12356	ğ’–	12000..123FF	Cuneiform	Cuneiform sign ushx		
U+12357	ğ’—	12000..123FF	Cuneiform	Cuneiform sign ush2		
U+12358	ğ’˜	12000..123FF	Cuneiform	Cuneiform sign ushumx		
U+12359	ğ’™	12000..123FF	Cuneiform	Cuneiform sign utuki		
U+1235A	ğ’š	12000..123FF	Cuneiform	Cuneiform sign uz3		
U+1235B	ğ’›	12000..123FF	Cuneiform	Cuneiform sign uz3 times kaskal		
U+1235C	ğ’œ	12000..123FF	Cuneiform	Cuneiform sign uzu		
U+1235D	ğ’	12000..123FF	Cuneiform	Cuneiform sign za		
U+1235E	ğ’	12000..123FF	Cuneiform	Cuneiform sign za tenu		
U+1235F	ğ’Ÿ	12000..123FF	Cuneiform	Cuneiform sign za squared times kur		
U+12360	ğ’ 	12000..123FF	Cuneiform	Cuneiform sign zag		
U+12361	ğ’¡	12000..123FF	Cuneiform	Cuneiform sign zamx		
U+12362	ğ’¢	12000..123FF	Cuneiform	Cuneiform sign ze2		
U+12363	ğ’£	12000..123FF	Cuneiform	Cuneiform sign zi		
U+12364	ğ’¤	12000..123FF	Cuneiform	Cuneiform sign zi over zi		
U+12365	ğ’¥	12000..123FF	Cuneiform	Cuneiform sign zi3		
U+12366	ğ’¦	12000..123FF	Cuneiform	Cuneiform sign zib		
U+12367	ğ’§	12000..123FF	Cuneiform	Cuneiform sign zib kaba tenu		
U+12368	ğ’¨	12000..123FF	Cuneiform	Cuneiform sign zig		
U+12369	ğ’©	12000..123FF	Cuneiform	Cuneiform sign ziz2		
U+1236A	ğ’ª	12000..123FF	Cuneiform	Cuneiform sign zu		
U+1236B	ğ’«	12000..123FF	Cuneiform	Cuneiform sign zu5		
U+1236C	ğ’¬	12000..123FF	Cuneiform	Cuneiform sign zu5 times a		
U+1236D	ğ’­	12000..123FF	Cuneiform	Cuneiform sign zubur		
U+1236E	ğ’®	12000..123FF	Cuneiform	Cuneiform sign zum		
U+1236F	ğ’¯	12000..123FF	Cuneiform	Cuneiform sign kap elamite		
U+12370	ğ’°	12000..123FF	Cuneiform	Cuneiform sign ab times nun		
U+12371	ğ’±	12000..123FF	Cuneiform	Cuneiform sign ab2 times a		
U+12372	ğ’²	12000..123FF	Cuneiform	Cuneiform sign amar times kug		
U+12373	ğ’³	12000..123FF	Cuneiform	Cuneiform sign dag kisim5 times u2 plus mash		
U+12374	ğ’´	12000..123FF	Cuneiform	Cuneiform sign dag3		
U+12375	ğ’µ	12000..123FF	Cuneiform	Cuneiform sign dish plus shu		
U+12376	ğ’¶	12000..123FF	Cuneiform	Cuneiform sign dub times she		
U+12377	ğ’·	12000..123FF	Cuneiform	Cuneiform sign ezen times gud		
U+12378	ğ’¸	12000..123FF	Cuneiform	Cuneiform sign ezen times she		
U+12379	ğ’¹	12000..123FF	Cuneiform	Cuneiform sign ga2 times an plus kak plus a		
U+1237A	ğ’º	12000..123FF	Cuneiform	Cuneiform sign ga2 times ash2		
U+1237B	ğ’»	12000..123FF	Cuneiform	Cuneiform sign ge22		
U+1237C	ğ’¼	12000..123FF	Cuneiform	Cuneiform sign gig		
U+1237D	ğ’½	12000..123FF	Cuneiform	Cuneiform sign hush		
U+1237E	ğ’¾	12000..123FF	Cuneiform	Cuneiform sign ka times anshe		
U+1237F	ğ’¿	12000..123FF	Cuneiform	Cuneiform sign ka times ash3		
U+12380	ğ’€	12000..123FF	Cuneiform	Cuneiform sign ka times gish		
U+12381	ğ’	12000..123FF	Cuneiform	Cuneiform sign ka times gud		
U+12382	ğ’‚	12000..123FF	Cuneiform	Cuneiform sign ka times hi times ash2		
U+12383	ğ’ƒ	12000..123FF	Cuneiform	Cuneiform sign ka times lum		
U+12384	ğ’„	12000..123FF	Cuneiform	Cuneiform sign ka times pa		
U+12385	ğ’…	12000..123FF	Cuneiform	Cuneiform sign ka times shul		
U+12386	ğ’†	12000..123FF	Cuneiform	Cuneiform sign ka times tu		
U+12387	ğ’‡	12000..123FF	Cuneiform	Cuneiform sign ka times ur2		
U+12388	ğ’ˆ	12000..123FF	Cuneiform	Cuneiform sign lagab times gi		
U+12389	ğ’‰	12000..123FF	Cuneiform	Cuneiform sign lu2 sheshig times bad		
U+1238A	ğ’Š	12000..123FF	Cuneiform	Cuneiform sign lu2 times esh2 plus lal		
U+1238B	ğ’‹	12000..123FF	Cuneiform	Cuneiform sign lu2 times shu		
U+1238C	ğ’Œ	12000..123FF	Cuneiform	Cuneiform sign mesh		
U+1238D	ğ’	12000..123FF	Cuneiform	Cuneiform sign mush3 times za		
U+1238E	ğ’	12000..123FF	Cuneiform	Cuneiform sign na4		
U+1238F	ğ’	12000..123FF	Cuneiform	Cuneiform sign nin		
U+12390	ğ’	12000..123FF	Cuneiform	Cuneiform sign nin9		
U+12391	ğ’‘	12000..123FF	Cuneiform	Cuneiform sign ninda2 times bal		
U+12392	ğ’’	12000..123FF	Cuneiform	Cuneiform sign ninda2 times gi		
U+12393	ğ’“	12000..123FF	Cuneiform	Cuneiform sign nu11 rotated ninety degrees		
U+12394	ğ’”	12000..123FF	Cuneiform	Cuneiform sign pesh2 asterisk		
U+12395	ğ’•	12000..123FF	Cuneiform	Cuneiform sign pir2		
U+12396	ğ’–	12000..123FF	Cuneiform	Cuneiform sign sag times igi gunu		
U+12397	ğ’—	12000..123FF	Cuneiform	Cuneiform sign ti2		
U+12398	ğ’˜	12000..123FF	Cuneiform	Cuneiform sign um times me		
U+12399	ğ’™	12000..123FF	Cuneiform	Cuneiform sign u u		
