code_point	symbol	block	block_name	name	tab_completion	latex_code
1BC00	"""ğ›°€"""	1BC00..1BC9F	Duployan	Duployan letter h		
1BC01	"""ğ›°"""	1BC00..1BC9F	Duployan	Duployan letter x		
1BC02	"""ğ›°‚"""	1BC00..1BC9F	Duployan	Duployan letter p		
1BC03	"""ğ›°ƒ"""	1BC00..1BC9F	Duployan	Duployan letter t		
1BC04	"""ğ›°„"""	1BC00..1BC9F	Duployan	Duployan letter f		
1BC05	"""ğ›°…"""	1BC00..1BC9F	Duployan	Duployan letter k		
1BC06	"""ğ›°†"""	1BC00..1BC9F	Duployan	Duployan letter l		
1BC07	"""ğ›°‡"""	1BC00..1BC9F	Duployan	Duployan letter b		
1BC08	"""ğ›°ˆ"""	1BC00..1BC9F	Duployan	Duployan letter d		
1BC09	"""ğ›°‰"""	1BC00..1BC9F	Duployan	Duployan letter v		
1BC0A	"""ğ›°Š"""	1BC00..1BC9F	Duployan	Duployan letter g		
1BC0B	"""ğ›°‹"""	1BC00..1BC9F	Duployan	Duployan letter r		
1BC0C	"""ğ›°Œ"""	1BC00..1BC9F	Duployan	Duployan letter p n		
1BC0D	"""ğ›°"""	1BC00..1BC9F	Duployan	Duployan letter d s		
1BC0E	"""ğ›°"""	1BC00..1BC9F	Duployan	Duployan letter f n		
1BC0F	"""ğ›°"""	1BC00..1BC9F	Duployan	Duployan letter k m		
1BC10	"""ğ›°"""	1BC00..1BC9F	Duployan	Duployan letter r s		
1BC11	"""ğ›°‘"""	1BC00..1BC9F	Duployan	Duployan letter th		
1BC12	"""ğ›°’"""	1BC00..1BC9F	Duployan	Duployan letter sloan dh		
1BC13	"""ğ›°“"""	1BC00..1BC9F	Duployan	Duployan letter dh		
1BC14	"""ğ›°”"""	1BC00..1BC9F	Duployan	Duployan letter kk		
1BC15	"""ğ›°•"""	1BC00..1BC9F	Duployan	Duployan letter sloan j		
1BC16	"""ğ›°–"""	1BC00..1BC9F	Duployan	Duployan letter hl		
1BC17	"""ğ›°—"""	1BC00..1BC9F	Duployan	Duployan letter lh		
1BC18	"""ğ›°˜"""	1BC00..1BC9F	Duployan	Duployan letter rh		
1BC19	"""ğ›°™"""	1BC00..1BC9F	Duployan	Duployan letter m		
1BC1A	"""ğ›°š"""	1BC00..1BC9F	Duployan	Duployan letter n		
1BC1B	"""ğ›°›"""	1BC00..1BC9F	Duployan	Duployan letter j		
1BC1C	"""ğ›°œ"""	1BC00..1BC9F	Duployan	Duployan letter s		
1BC1D	"""ğ›°"""	1BC00..1BC9F	Duployan	Duployan letter m n		
1BC1E	"""ğ›°"""	1BC00..1BC9F	Duployan	Duployan letter n m		
1BC1F	"""ğ›°Ÿ"""	1BC00..1BC9F	Duployan	Duployan letter j m		
1BC20	"""ğ›° """	1BC00..1BC9F	Duployan	Duployan letter s j		
1BC21	"""ğ›°¡"""	1BC00..1BC9F	Duployan	Duployan letter m with dot		
1BC22	"""ğ›°¢"""	1BC00..1BC9F	Duployan	Duployan letter n with dot		
1BC23	"""ğ›°£"""	1BC00..1BC9F	Duployan	Duployan letter j with dot		
1BC24	"""ğ›°¤"""	1BC00..1BC9F	Duployan	Duployan letter j with dots inside and above		
1BC25	"""ğ›°¥"""	1BC00..1BC9F	Duployan	Duployan letter s with dot		
1BC26	"""ğ›°¦"""	1BC00..1BC9F	Duployan	Duployan letter s with dot below		
1BC27	"""ğ›°§"""	1BC00..1BC9F	Duployan	Duployan letter m s		
1BC28	"""ğ›°¨"""	1BC00..1BC9F	Duployan	Duployan letter n s		
1BC29	"""ğ›°©"""	1BC00..1BC9F	Duployan	Duployan letter j s		
1BC2A	"""ğ›°ª"""	1BC00..1BC9F	Duployan	Duployan letter s s		
1BC2B	"""ğ›°«"""	1BC00..1BC9F	Duployan	Duployan letter m n s		
1BC2C	"""ğ›°¬"""	1BC00..1BC9F	Duployan	Duployan letter n m s		
1BC2D	"""ğ›°­"""	1BC00..1BC9F	Duployan	Duployan letter j m s		
1BC2E	"""ğ›°®"""	1BC00..1BC9F	Duployan	Duployan letter s j s		
1BC2F	"""ğ›°¯"""	1BC00..1BC9F	Duployan	Duployan letter j s with dot		
1BC30	"""ğ›°°"""	1BC00..1BC9F	Duployan	Duployan letter j n		
1BC31	"""ğ›°±"""	1BC00..1BC9F	Duployan	Duployan letter j n s		
1BC32	"""ğ›°²"""	1BC00..1BC9F	Duployan	Duployan letter s t		
1BC33	"""ğ›°³"""	1BC00..1BC9F	Duployan	Duployan letter s t r		
1BC34	"""ğ›°´"""	1BC00..1BC9F	Duployan	Duployan letter s p		
1BC35	"""ğ›°µ"""	1BC00..1BC9F	Duployan	Duployan letter s p r		
1BC36	"""ğ›°¶"""	1BC00..1BC9F	Duployan	Duployan letter t s		
1BC37	"""ğ›°·"""	1BC00..1BC9F	Duployan	Duployan letter t r s		
1BC38	"""ğ›°¸"""	1BC00..1BC9F	Duployan	Duployan letter w		
1BC39	"""ğ›°¹"""	1BC00..1BC9F	Duployan	Duployan letter wh		
1BC3A	"""ğ›°º"""	1BC00..1BC9F	Duployan	Duployan letter w r		
1BC3B	"""ğ›°»"""	1BC00..1BC9F	Duployan	Duployan letter s n		
1BC3C	"""ğ›°¼"""	1BC00..1BC9F	Duployan	Duployan letter s m		
1BC3D	"""ğ›°½"""	1BC00..1BC9F	Duployan	Duployan letter k r s		
1BC3E	"""ğ›°¾"""	1BC00..1BC9F	Duployan	Duployan letter g r s		
1BC3F	"""ğ›°¿"""	1BC00..1BC9F	Duployan	Duployan letter s k		
1BC40	"""ğ›±€"""	1BC00..1BC9F	Duployan	Duployan letter s k r		
1BC41	"""ğ›±"""	1BC00..1BC9F	Duployan	Duployan letter a		
1BC42	"""ğ›±‚"""	1BC00..1BC9F	Duployan	Duployan letter sloan ow		
1BC43	"""ğ›±ƒ"""	1BC00..1BC9F	Duployan	Duployan letter oa		
1BC44	"""ğ›±„"""	1BC00..1BC9F	Duployan	Duployan letter o		
1BC45	"""ğ›±…"""	1BC00..1BC9F	Duployan	Duployan letter aou		
1BC46	"""ğ›±†"""	1BC00..1BC9F	Duployan	Duployan letter i		
1BC47	"""ğ›±‡"""	1BC00..1BC9F	Duployan	Duployan letter e		
1BC48	"""ğ›±ˆ"""	1BC00..1BC9F	Duployan	Duployan letter ie		
1BC49	"""ğ›±‰"""	1BC00..1BC9F	Duployan	Duployan letter short i		
1BC4A	"""ğ›±Š"""	1BC00..1BC9F	Duployan	Duployan letter ui		
1BC4B	"""ğ›±‹"""	1BC00..1BC9F	Duployan	Duployan letter ee		
1BC4C	"""ğ›±Œ"""	1BC00..1BC9F	Duployan	Duployan letter sloan eh		
1BC4D	"""ğ›±"""	1BC00..1BC9F	Duployan	Duployan letter romanian i		
1BC4E	"""ğ›±"""	1BC00..1BC9F	Duployan	Duployan letter sloan ee		
1BC4F	"""ğ›±"""	1BC00..1BC9F	Duployan	Duployan letter long i		
1BC50	"""ğ›±"""	1BC00..1BC9F	Duployan	Duployan letter ye		
1BC51	"""ğ›±‘"""	1BC00..1BC9F	Duployan	Duployan letter u		
1BC52	"""ğ›±’"""	1BC00..1BC9F	Duployan	Duployan letter eu		
1BC53	"""ğ›±“"""	1BC00..1BC9F	Duployan	Duployan letter xw		
1BC54	"""ğ›±”"""	1BC00..1BC9F	Duployan	Duployan letter u n		
1BC55	"""ğ›±•"""	1BC00..1BC9F	Duployan	Duployan letter long u		
1BC56	"""ğ›±–"""	1BC00..1BC9F	Duployan	Duployan letter romanian u		
1BC57	"""ğ›±—"""	1BC00..1BC9F	Duployan	Duployan letter uh		
1BC58	"""ğ›±˜"""	1BC00..1BC9F	Duployan	Duployan letter sloan u		
1BC59	"""ğ›±™"""	1BC00..1BC9F	Duployan	Duployan letter ooh		
1BC5A	"""ğ›±š"""	1BC00..1BC9F	Duployan	Duployan letter ow		
1BC5B	"""ğ›±›"""	1BC00..1BC9F	Duployan	Duployan letter ou		
1BC5C	"""ğ›±œ"""	1BC00..1BC9F	Duployan	Duployan letter wa		
1BC5D	"""ğ›±"""	1BC00..1BC9F	Duployan	Duployan letter wo		
1BC5E	"""ğ›±"""	1BC00..1BC9F	Duployan	Duployan letter wi		
1BC5F	"""ğ›±Ÿ"""	1BC00..1BC9F	Duployan	Duployan letter wei		
1BC60	"""ğ›± """	1BC00..1BC9F	Duployan	Duployan letter wow		
1BC61	"""ğ›±¡"""	1BC00..1BC9F	Duployan	Duployan letter nasal u		
1BC62	"""ğ›±¢"""	1BC00..1BC9F	Duployan	Duployan letter nasal o		
1BC63	"""ğ›±£"""	1BC00..1BC9F	Duployan	Duployan letter nasal i		
1BC64	"""ğ›±¤"""	1BC00..1BC9F	Duployan	Duployan letter nasal a		
1BC65	"""ğ›±¥"""	1BC00..1BC9F	Duployan	Duployan letter pernin an		
1BC66	"""ğ›±¦"""	1BC00..1BC9F	Duployan	Duployan letter pernin am		
1BC67	"""ğ›±§"""	1BC00..1BC9F	Duployan	Duployan letter sloan en		
1BC68	"""ğ›±¨"""	1BC00..1BC9F	Duployan	Duployan letter sloan an		
1BC69	"""ğ›±©"""	1BC00..1BC9F	Duployan	Duployan letter sloan on		
1BC6A	"""ğ›±ª"""	1BC00..1BC9F	Duployan	Duployan letter vocalic m		
1BC70	"""ğ›±°"""	1BC00..1BC9F	Duployan	Duployan affix left horizontal secant		
1BC71	"""ğ›±±"""	1BC00..1BC9F	Duployan	Duployan affix mid horizontal secant		
1BC72	"""ğ›±²"""	1BC00..1BC9F	Duployan	Duployan affix right horizontal secant		
1BC73	"""ğ›±³"""	1BC00..1BC9F	Duployan	Duployan affix low vertical secant		
1BC74	"""ğ›±´"""	1BC00..1BC9F	Duployan	Duployan affix mid vertical secant		
1BC75	"""ğ›±µ"""	1BC00..1BC9F	Duployan	Duployan affix high vertical secant		
1BC76	"""ğ›±¶"""	1BC00..1BC9F	Duployan	Duployan affix attached secant		
1BC77	"""ğ›±·"""	1BC00..1BC9F	Duployan	Duployan affix attached left-to-right secant		
1BC78	"""ğ›±¸"""	1BC00..1BC9F	Duployan	Duployan affix attached tangent		
1BC79	"""ğ›±¹"""	1BC00..1BC9F	Duployan	Duployan affix attached tail		
1BC7A	"""ğ›±º"""	1BC00..1BC9F	Duployan	Duployan affix attached e hook		
1BC7B	"""ğ›±»"""	1BC00..1BC9F	Duployan	Duployan affix attached i hook		
1BC7C	"""ğ›±¼"""	1BC00..1BC9F	Duployan	Duployan affix attached tangent hook		
1BC80	"""ğ›²€"""	1BC00..1BC9F	Duployan	Duployan affix high acute		
1BC81	"""ğ›²"""	1BC00..1BC9F	Duployan	Duployan affix high tight acute		
1BC82	"""ğ›²‚"""	1BC00..1BC9F	Duployan	Duployan affix high grave		
1BC83	"""ğ›²ƒ"""	1BC00..1BC9F	Duployan	Duployan affix high long grave		
1BC84	"""ğ›²„"""	1BC00..1BC9F	Duployan	Duployan affix high dot		
1BC85	"""ğ›²…"""	1BC00..1BC9F	Duployan	Duployan affix high circle		
1BC86	"""ğ›²†"""	1BC00..1BC9F	Duployan	Duployan affix high line		
1BC87	"""ğ›²‡"""	1BC00..1BC9F	Duployan	Duployan affix high wave		
1BC88	"""ğ›²ˆ"""	1BC00..1BC9F	Duployan	Duployan affix high vertical		
1BC90	"""ğ›²"""	1BC00..1BC9F	Duployan	Duployan affix low acute		
1BC91	"""ğ›²‘"""	1BC00..1BC9F	Duployan	Duployan affix low tight acute		
1BC92	"""ğ›²’"""	1BC00..1BC9F	Duployan	Duployan affix low grave		
1BC93	"""ğ›²“"""	1BC00..1BC9F	Duployan	Duployan affix low long grave		
1BC94	"""ğ›²”"""	1BC00..1BC9F	Duployan	Duployan affix low dot		
1BC95	"""ğ›²•"""	1BC00..1BC9F	Duployan	Duployan affix low circle		
1BC96	"""ğ›²–"""	1BC00..1BC9F	Duployan	Duployan affix low line		
1BC97	"""ğ›²—"""	1BC00..1BC9F	Duployan	Duployan affix low wave		
1BC98	"""ğ›²˜"""	1BC00..1BC9F	Duployan	Duployan affix low vertical		
1BC99	"""ğ›²™"""	1BC00..1BC9F	Duployan	Duployan affix low arrow		
1BC9C	"""ğ›²œ"""	1BC00..1BC9F	Duployan	Duployan sign o with cross		
1BC9D	"""ğ›²"""	1BC00..1BC9F	Duployan	Duployan thick letter selector		
1BC9E	"""ğ›²"""	1BC00..1BC9F	Duployan	Duployan double mark		
1BC9F	"""ğ›²Ÿ"""	1BC00..1BC9F	Duployan	Duployan punctuation chinook full stop		
