code_point	symbol	block	block_name	name	tab_completion	latex_code
U+1D000	ğ€€	1D000..1D0FF	Byzantine Musical Symbols	Byzantine musical symbol psili		
U+1D001	ğ€	1D000..1D0FF	Byzantine Musical Symbols	Byzantine musical symbol daseia		
U+1D002	ğ€‚	1D000..1D0FF	Byzantine Musical Symbols	Byzantine musical symbol perispomeni		
U+1D003	ğ€ƒ	1D000..1D0FF	Byzantine Musical Symbols	Byzantine musical symbol oxeia ekfonitikon		
U+1D004	ğ€„	1D000..1D0FF	Byzantine Musical Symbols	Byzantine musical symbol oxeia dipli		
U+1D005	ğ€…	1D000..1D0FF	Byzantine Musical Symbols	Byzantine musical symbol vareia ekfonitikon		
U+1D006	ğ€†	1D000..1D0FF	Byzantine Musical Symbols	Byzantine musical symbol vareia dipli		
U+1D007	ğ€‡	1D000..1D0FF	Byzantine Musical Symbols	Byzantine musical symbol kathisti		
U+1D008	ğ€ˆ	1D000..1D0FF	Byzantine Musical Symbols	Byzantine musical symbol syrmatiki		
U+1D009	ğ€‰	1D000..1D0FF	Byzantine Musical Symbols	Byzantine musical symbol paraklitiki		
U+1D00A	ğ€Š	1D000..1D0FF	Byzantine Musical Symbols	Byzantine musical symbol ypokrisis		
U+1D00B	ğ€‹	1D000..1D0FF	Byzantine Musical Symbols	Byzantine musical symbol ypokrisis dipli		
U+1D00C	ğ€Œ	1D000..1D0FF	Byzantine Musical Symbols	Byzantine musical symbol kremasti		
U+1D00D	ğ€	1D000..1D0FF	Byzantine Musical Symbols	Byzantine musical symbol apeso ekfonitikon		
U+1D00E	ğ€	1D000..1D0FF	Byzantine Musical Symbols	Byzantine musical symbol exo ekfonitikon		
U+1D00F	ğ€	1D000..1D0FF	Byzantine Musical Symbols	Byzantine musical symbol teleia		
U+1D010	ğ€	1D000..1D0FF	Byzantine Musical Symbols	Byzantine musical symbol kentimata		
U+1D011	ğ€‘	1D000..1D0FF	Byzantine Musical Symbols	Byzantine musical symbol apostrofos		
U+1D012	ğ€’	1D000..1D0FF	Byzantine Musical Symbols	Byzantine musical symbol apostrofos dipli		
U+1D013	ğ€“	1D000..1D0FF	Byzantine Musical Symbols	Byzantine musical symbol synevma		
U+1D014	ğ€”	1D000..1D0FF	Byzantine Musical Symbols	Byzantine musical symbol thita		
U+1D015	ğ€•	1D000..1D0FF	Byzantine Musical Symbols	Byzantine musical symbol oligon archaion		
U+1D016	ğ€–	1D000..1D0FF	Byzantine Musical Symbols	Byzantine musical symbol gorgon archaion		
U+1D017	ğ€—	1D000..1D0FF	Byzantine Musical Symbols	Byzantine musical symbol psilon		
U+1D018	ğ€˜	1D000..1D0FF	Byzantine Musical Symbols	Byzantine musical symbol chamilon		
U+1D019	ğ€™	1D000..1D0FF	Byzantine Musical Symbols	Byzantine musical symbol vathy		
U+1D01A	ğ€š	1D000..1D0FF	Byzantine Musical Symbols	Byzantine musical symbol ison archaion		
U+1D01B	ğ€›	1D000..1D0FF	Byzantine Musical Symbols	Byzantine musical symbol kentima archaion		
U+1D01C	ğ€œ	1D000..1D0FF	Byzantine Musical Symbols	Byzantine musical symbol kentimata archaion		
U+1D01D	ğ€	1D000..1D0FF	Byzantine Musical Symbols	Byzantine musical symbol saximata		
U+1D01E	ğ€	1D000..1D0FF	Byzantine Musical Symbols	Byzantine musical symbol parichon		
U+1D01F	ğ€Ÿ	1D000..1D0FF	Byzantine Musical Symbols	Byzantine musical symbol stavros apodexia		
U+1D020	ğ€ 	1D000..1D0FF	Byzantine Musical Symbols	Byzantine musical symbol oxeiai archaion		
U+1D021	ğ€¡	1D000..1D0FF	Byzantine Musical Symbols	Byzantine musical symbol vareiai archaion		
U+1D022	ğ€¢	1D000..1D0FF	Byzantine Musical Symbols	Byzantine musical symbol apoderma archaion		
U+1D023	ğ€£	1D000..1D0FF	Byzantine Musical Symbols	Byzantine musical symbol apothema		
U+1D024	ğ€¤	1D000..1D0FF	Byzantine Musical Symbols	Byzantine musical symbol klasma		
U+1D025	ğ€¥	1D000..1D0FF	Byzantine Musical Symbols	Byzantine musical symbol revma		
U+1D026	ğ€¦	1D000..1D0FF	Byzantine Musical Symbols	Byzantine musical symbol piasma archaion		
U+1D027	ğ€§	1D000..1D0FF	Byzantine Musical Symbols	Byzantine musical symbol tinagma		
U+1D028	ğ€¨	1D000..1D0FF	Byzantine Musical Symbols	Byzantine musical symbol anatrichisma		
U+1D029	ğ€©	1D000..1D0FF	Byzantine Musical Symbols	Byzantine musical symbol seisma		
U+1D02A	ğ€ª	1D000..1D0FF	Byzantine Musical Symbols	Byzantine musical symbol synagma archaion		
U+1D02B	ğ€«	1D000..1D0FF	Byzantine Musical Symbols	Byzantine musical symbol synagma meta stavrou		
U+1D02C	ğ€¬	1D000..1D0FF	Byzantine Musical Symbols	Byzantine musical symbol oyranisma archaion		
U+1D02D	ğ€­	1D000..1D0FF	Byzantine Musical Symbols	Byzantine musical symbol thema		
U+1D02E	ğ€®	1D000..1D0FF	Byzantine Musical Symbols	Byzantine musical symbol lemoi		
U+1D02F	ğ€¯	1D000..1D0FF	Byzantine Musical Symbols	Byzantine musical symbol dyo		
U+1D030	ğ€°	1D000..1D0FF	Byzantine Musical Symbols	Byzantine musical symbol tria		
U+1D031	ğ€±	1D000..1D0FF	Byzantine Musical Symbols	Byzantine musical symbol tessera		
U+1D032	ğ€²	1D000..1D0FF	Byzantine Musical Symbols	Byzantine musical symbol kratimata		
U+1D033	ğ€³	1D000..1D0FF	Byzantine Musical Symbols	Byzantine musical symbol apeso exo neo		
U+1D034	ğ€´	1D000..1D0FF	Byzantine Musical Symbols	Byzantine musical symbol fthora archaion		
U+1D035	ğ€µ	1D000..1D0FF	Byzantine Musical Symbols	Byzantine musical symbol imifthora		
U+1D036	ğ€¶	1D000..1D0FF	Byzantine Musical Symbols	Byzantine musical symbol tromikon archaion		
U+1D037	ğ€·	1D000..1D0FF	Byzantine Musical Symbols	Byzantine musical symbol katava tromikon		
U+1D038	ğ€¸	1D000..1D0FF	Byzantine Musical Symbols	Byzantine musical symbol pelaston		
U+1D039	ğ€¹	1D000..1D0FF	Byzantine Musical Symbols	Byzantine musical symbol psifiston		
U+1D03A	ğ€º	1D000..1D0FF	Byzantine Musical Symbols	Byzantine musical symbol kontevma		
U+1D03B	ğ€»	1D000..1D0FF	Byzantine Musical Symbols	Byzantine musical symbol chorevma archaion		
U+1D03C	ğ€¼	1D000..1D0FF	Byzantine Musical Symbols	Byzantine musical symbol rapisma		
U+1D03D	ğ€½	1D000..1D0FF	Byzantine Musical Symbols	Byzantine musical symbol parakalesma archaion		
U+1D03E	ğ€¾	1D000..1D0FF	Byzantine Musical Symbols	Byzantine musical symbol paraklitiki archaion		
U+1D03F	ğ€¿	1D000..1D0FF	Byzantine Musical Symbols	Byzantine musical symbol ichadin		
U+1D040	ğ€	1D000..1D0FF	Byzantine Musical Symbols	Byzantine musical symbol nana		
U+1D041	ğ	1D000..1D0FF	Byzantine Musical Symbols	Byzantine musical symbol petasma		
U+1D042	ğ‚	1D000..1D0FF	Byzantine Musical Symbols	Byzantine musical symbol kontevma allo		
U+1D043	ğƒ	1D000..1D0FF	Byzantine Musical Symbols	Byzantine musical symbol tromikon allo		
U+1D044	ğ„	1D000..1D0FF	Byzantine Musical Symbols	Byzantine musical symbol straggismata		
U+1D045	ğ…	1D000..1D0FF	Byzantine Musical Symbols	Byzantine musical symbol gronthismata		
U+1D046	ğ†	1D000..1D0FF	Byzantine Musical Symbols	Byzantine musical symbol ison neo		
U+1D047	ğ‡	1D000..1D0FF	Byzantine Musical Symbols	Byzantine musical symbol oligon neo		
U+1D048	ğˆ	1D000..1D0FF	Byzantine Musical Symbols	Byzantine musical symbol oxeia neo		
U+1D049	ğ‰	1D000..1D0FF	Byzantine Musical Symbols	Byzantine musical symbol petasti		
U+1D04A	ğŠ	1D000..1D0FF	Byzantine Musical Symbols	Byzantine musical symbol koufisma		
U+1D04B	ğ‹	1D000..1D0FF	Byzantine Musical Symbols	Byzantine musical symbol petastokoufisma		
U+1D04C	ğŒ	1D000..1D0FF	Byzantine Musical Symbols	Byzantine musical symbol kratimokoufisma		
U+1D04D	ğ	1D000..1D0FF	Byzantine Musical Symbols	Byzantine musical symbol pelaston neo		
U+1D04E	ğ	1D000..1D0FF	Byzantine Musical Symbols	Byzantine musical symbol kentimata neo ano		
U+1D04F	ğ	1D000..1D0FF	Byzantine Musical Symbols	Byzantine musical symbol kentima neo ano		
U+1D050	ğ	1D000..1D0FF	Byzantine Musical Symbols	Byzantine musical symbol ypsili		
U+1D051	ğ‘	1D000..1D0FF	Byzantine Musical Symbols	Byzantine musical symbol apostrofos neo		
U+1D052	ğ’	1D000..1D0FF	Byzantine Musical Symbols	Byzantine musical symbol apostrofoi syndesmos neo		
U+1D053	ğ“	1D000..1D0FF	Byzantine Musical Symbols	Byzantine musical symbol yporroi		
U+1D054	ğ”	1D000..1D0FF	Byzantine Musical Symbols	Byzantine musical symbol kratimoyporroon		
U+1D055	ğ•	1D000..1D0FF	Byzantine Musical Symbols	Byzantine musical symbol elafron		
U+1D056	ğ–	1D000..1D0FF	Byzantine Musical Symbols	Byzantine musical symbol chamili		
U+1D057	ğ—	1D000..1D0FF	Byzantine Musical Symbols	Byzantine musical symbol mikron ison		
U+1D058	ğ˜	1D000..1D0FF	Byzantine Musical Symbols	Byzantine musical symbol vareia neo		
U+1D059	ğ™	1D000..1D0FF	Byzantine Musical Symbols	Byzantine musical symbol piasma neo		
U+1D05A	ğš	1D000..1D0FF	Byzantine Musical Symbols	Byzantine musical symbol psifiston neo		
U+1D05B	ğ›	1D000..1D0FF	Byzantine Musical Symbols	Byzantine musical symbol omalon		
U+1D05C	ğœ	1D000..1D0FF	Byzantine Musical Symbols	Byzantine musical symbol antikenoma		
U+1D05D	ğ	1D000..1D0FF	Byzantine Musical Symbols	Byzantine musical symbol lygisma		
U+1D05E	ğ	1D000..1D0FF	Byzantine Musical Symbols	Byzantine musical symbol paraklitiki neo		
U+1D05F	ğŸ	1D000..1D0FF	Byzantine Musical Symbols	Byzantine musical symbol parakalesma neo		
U+1D060	ğ 	1D000..1D0FF	Byzantine Musical Symbols	Byzantine musical symbol eteron parakalesma		
U+1D061	ğ¡	1D000..1D0FF	Byzantine Musical Symbols	Byzantine musical symbol kylisma		
U+1D062	ğ¢	1D000..1D0FF	Byzantine Musical Symbols	Byzantine musical symbol antikenokylisma		
U+1D063	ğ£	1D000..1D0FF	Byzantine Musical Symbols	Byzantine musical symbol tromikon neo		
U+1D064	ğ¤	1D000..1D0FF	Byzantine Musical Symbols	Byzantine musical symbol ekstrepton		
U+1D065	ğ¥	1D000..1D0FF	Byzantine Musical Symbols	Byzantine musical symbol synagma neo		
U+1D066	ğ¦	1D000..1D0FF	Byzantine Musical Symbols	Byzantine musical symbol syrma		
U+1D067	ğ§	1D000..1D0FF	Byzantine Musical Symbols	Byzantine musical symbol chorevma neo		
U+1D068	ğ¨	1D000..1D0FF	Byzantine Musical Symbols	Byzantine musical symbol epegerma		
U+1D069	ğ©	1D000..1D0FF	Byzantine Musical Symbols	Byzantine musical symbol seisma neo		
U+1D06A	ğª	1D000..1D0FF	Byzantine Musical Symbols	Byzantine musical symbol xiron klasma		
U+1D06B	ğ«	1D000..1D0FF	Byzantine Musical Symbols	Byzantine musical symbol tromikopsifiston		
U+1D06C	ğ¬	1D000..1D0FF	Byzantine Musical Symbols	Byzantine musical symbol psifistolygisma		
U+1D06D	ğ­	1D000..1D0FF	Byzantine Musical Symbols	Byzantine musical symbol tromikolygisma		
U+1D06E	ğ®	1D000..1D0FF	Byzantine Musical Symbols	Byzantine musical symbol tromikoparakalesma		
U+1D06F	ğ¯	1D000..1D0FF	Byzantine Musical Symbols	Byzantine musical symbol psifistoparakalesma		
U+1D070	ğ°	1D000..1D0FF	Byzantine Musical Symbols	Byzantine musical symbol tromikosynagma		
U+1D071	ğ±	1D000..1D0FF	Byzantine Musical Symbols	Byzantine musical symbol psifistosynagma		
U+1D072	ğ²	1D000..1D0FF	Byzantine Musical Symbols	Byzantine musical symbol gorgosyntheton		
U+1D073	ğ³	1D000..1D0FF	Byzantine Musical Symbols	Byzantine musical symbol argosyntheton		
U+1D074	ğ´	1D000..1D0FF	Byzantine Musical Symbols	Byzantine musical symbol eteron argosyntheton		
U+1D075	ğµ	1D000..1D0FF	Byzantine Musical Symbols	Byzantine musical symbol oyranisma neo		
U+1D076	ğ¶	1D000..1D0FF	Byzantine Musical Symbols	Byzantine musical symbol thematismos eso		
U+1D077	ğ·	1D000..1D0FF	Byzantine Musical Symbols	Byzantine musical symbol thematismos exo		
U+1D078	ğ¸	1D000..1D0FF	Byzantine Musical Symbols	Byzantine musical symbol thema aploun		
U+1D079	ğ¹	1D000..1D0FF	Byzantine Musical Symbols	Byzantine musical symbol thes kai apothes		
U+1D07A	ğº	1D000..1D0FF	Byzantine Musical Symbols	Byzantine musical symbol katavasma		
U+1D07B	ğ»	1D000..1D0FF	Byzantine Musical Symbols	Byzantine musical symbol endofonon		
U+1D07C	ğ¼	1D000..1D0FF	Byzantine Musical Symbols	Byzantine musical symbol yfen kato		
U+1D07D	ğ½	1D000..1D0FF	Byzantine Musical Symbols	Byzantine musical symbol yfen ano		
U+1D07E	ğ¾	1D000..1D0FF	Byzantine Musical Symbols	Byzantine musical symbol stavros		
U+1D07F	ğ¿	1D000..1D0FF	Byzantine Musical Symbols	Byzantine musical symbol klasma ano		
U+1D080	ğ‚€	1D000..1D0FF	Byzantine Musical Symbols	Byzantine musical symbol dipli archaion		
U+1D081	ğ‚	1D000..1D0FF	Byzantine Musical Symbols	Byzantine musical symbol kratima archaion		
U+1D082	ğ‚‚	1D000..1D0FF	Byzantine Musical Symbols	Byzantine musical symbol kratima allo		
U+1D083	ğ‚ƒ	1D000..1D0FF	Byzantine Musical Symbols	Byzantine musical symbol kratima neo		
U+1D084	ğ‚„	1D000..1D0FF	Byzantine Musical Symbols	Byzantine musical symbol apoderma neo		
U+1D085	ğ‚…	1D000..1D0FF	Byzantine Musical Symbols	Byzantine musical symbol apli		
U+1D086	ğ‚†	1D000..1D0FF	Byzantine Musical Symbols	Byzantine musical symbol dipli		
U+1D087	ğ‚‡	1D000..1D0FF	Byzantine Musical Symbols	Byzantine musical symbol tripli		
U+1D088	ğ‚ˆ	1D000..1D0FF	Byzantine Musical Symbols	Byzantine musical symbol tetrapli		
U+1D089	ğ‚‰	1D000..1D0FF	Byzantine Musical Symbols	Byzantine musical symbol koronis		
U+1D08A	ğ‚Š	1D000..1D0FF	Byzantine Musical Symbols	Byzantine musical symbol leimma enos chronou		
U+1D08B	ğ‚‹	1D000..1D0FF	Byzantine Musical Symbols	Byzantine musical symbol leimma dyo chronon		
U+1D08C	ğ‚Œ	1D000..1D0FF	Byzantine Musical Symbols	Byzantine musical symbol leimma trion chronon		
U+1D08D	ğ‚	1D000..1D0FF	Byzantine Musical Symbols	Byzantine musical symbol leimma tessaron chronon		
U+1D08E	ğ‚	1D000..1D0FF	Byzantine Musical Symbols	Byzantine musical symbol leimma imiseos chronou		
U+1D08F	ğ‚	1D000..1D0FF	Byzantine Musical Symbols	Byzantine musical symbol gorgon neo ano		
U+1D090	ğ‚	1D000..1D0FF	Byzantine Musical Symbols	Byzantine musical symbol gorgon parestigmenon aristera		
U+1D091	ğ‚‘	1D000..1D0FF	Byzantine Musical Symbols	Byzantine musical symbol gorgon parestigmenon dexia		
U+1D092	ğ‚’	1D000..1D0FF	Byzantine Musical Symbols	Byzantine musical symbol digorgon		
U+1D093	ğ‚“	1D000..1D0FF	Byzantine Musical Symbols	Byzantine musical symbol digorgon parestigmenon aristera kato		
U+1D094	ğ‚”	1D000..1D0FF	Byzantine Musical Symbols	Byzantine musical symbol digorgon parestigmenon aristera ano		
U+1D095	ğ‚•	1D000..1D0FF	Byzantine Musical Symbols	Byzantine musical symbol digorgon parestigmenon dexia		
U+1D096	ğ‚–	1D000..1D0FF	Byzantine Musical Symbols	Byzantine musical symbol trigorgon		
U+1D097	ğ‚—	1D000..1D0FF	Byzantine Musical Symbols	Byzantine musical symbol argon		
U+1D098	ğ‚˜	1D000..1D0FF	Byzantine Musical Symbols	Byzantine musical symbol imidiargon		
U+1D099	ğ‚™	1D000..1D0FF	Byzantine Musical Symbols	Byzantine musical symbol diargon		
U+1D09A	ğ‚š	1D000..1D0FF	Byzantine Musical Symbols	Byzantine musical symbol agogi poli argi		
U+1D09B	ğ‚›	1D000..1D0FF	Byzantine Musical Symbols	Byzantine musical symbol agogi argoteri		
U+1D09C	ğ‚œ	1D000..1D0FF	Byzantine Musical Symbols	Byzantine musical symbol agogi argi		
U+1D09D	ğ‚	1D000..1D0FF	Byzantine Musical Symbols	Byzantine musical symbol agogi metria		
U+1D09E	ğ‚	1D000..1D0FF	Byzantine Musical Symbols	Byzantine musical symbol agogi mesi		
U+1D09F	ğ‚Ÿ	1D000..1D0FF	Byzantine Musical Symbols	Byzantine musical symbol agogi gorgi		
U+1D0A0	ğ‚ 	1D000..1D0FF	Byzantine Musical Symbols	Byzantine musical symbol agogi gorgoteri		
U+1D0A1	ğ‚¡	1D000..1D0FF	Byzantine Musical Symbols	Byzantine musical symbol agogi poli gorgi		
U+1D0A2	ğ‚¢	1D000..1D0FF	Byzantine Musical Symbols	Byzantine musical symbol martyria protos ichos		
U+1D0A3	ğ‚£	1D000..1D0FF	Byzantine Musical Symbols	Byzantine musical symbol martyria alli protos ichos		
U+1D0A4	ğ‚¤	1D000..1D0FF	Byzantine Musical Symbols	Byzantine musical symbol martyria deyteros ichos		
U+1D0A5	ğ‚¥	1D000..1D0FF	Byzantine Musical Symbols	Byzantine musical symbol martyria alli deyteros ichos		
U+1D0A6	ğ‚¦	1D000..1D0FF	Byzantine Musical Symbols	Byzantine musical symbol martyria tritos ichos		
U+1D0A7	ğ‚§	1D000..1D0FF	Byzantine Musical Symbols	Byzantine musical symbol martyria trifonias		
U+1D0A8	ğ‚¨	1D000..1D0FF	Byzantine Musical Symbols	Byzantine musical symbol martyria tetartos ichos		
U+1D0A9	ğ‚©	1D000..1D0FF	Byzantine Musical Symbols	Byzantine musical symbol martyria tetartos legetos ichos		
U+1D0AA	ğ‚ª	1D000..1D0FF	Byzantine Musical Symbols	Byzantine musical symbol martyria legetos ichos		
U+1D0AB	ğ‚«	1D000..1D0FF	Byzantine Musical Symbols	Byzantine musical symbol martyria plagios ichos		
U+1D0AC	ğ‚¬	1D000..1D0FF	Byzantine Musical Symbols	Byzantine musical symbol isakia telous ichimatos		
U+1D0AD	ğ‚­	1D000..1D0FF	Byzantine Musical Symbols	Byzantine musical symbol apostrofoi telous ichimatos		
U+1D0AE	ğ‚®	1D000..1D0FF	Byzantine Musical Symbols	Byzantine musical symbol fanerosis tetrafonias		
U+1D0AF	ğ‚¯	1D000..1D0FF	Byzantine Musical Symbols	Byzantine musical symbol fanerosis monofonias		
U+1D0B0	ğ‚°	1D000..1D0FF	Byzantine Musical Symbols	Byzantine musical symbol fanerosis difonias		
U+1D0B1	ğ‚±	1D000..1D0FF	Byzantine Musical Symbols	Byzantine musical symbol martyria varys ichos		
U+1D0B2	ğ‚²	1D000..1D0FF	Byzantine Musical Symbols	Byzantine musical symbol martyria protovarys ichos		
U+1D0B3	ğ‚³	1D000..1D0FF	Byzantine Musical Symbols	Byzantine musical symbol martyria plagios tetartos ichos		
U+1D0B4	ğ‚´	1D000..1D0FF	Byzantine Musical Symbols	Byzantine musical symbol gorthmikon n aploun		
U+1D0B5	ğ‚µ	1D000..1D0FF	Byzantine Musical Symbols	Byzantine musical symbol gorthmikon n diploun		
U+1D0B6	ğ‚¶	1D000..1D0FF	Byzantine Musical Symbols	Byzantine musical symbol enarxis kai fthora vou		
U+1D0B7	ğ‚·	1D000..1D0FF	Byzantine Musical Symbols	Byzantine musical symbol imifonon		
U+1D0B8	ğ‚¸	1D000..1D0FF	Byzantine Musical Symbols	Byzantine musical symbol imifthoron		
U+1D0B9	ğ‚¹	1D000..1D0FF	Byzantine Musical Symbols	Byzantine musical symbol fthora archaion deyterou ichou		
U+1D0BA	ğ‚º	1D000..1D0FF	Byzantine Musical Symbols	Byzantine musical symbol fthora diatoniki pa		
U+1D0BB	ğ‚»	1D000..1D0FF	Byzantine Musical Symbols	Byzantine musical symbol fthora diatoniki nana		
U+1D0BC	ğ‚¼	1D000..1D0FF	Byzantine Musical Symbols	Byzantine musical symbol fthora naos ichos		
U+1D0BD	ğ‚½	1D000..1D0FF	Byzantine Musical Symbols	Byzantine musical symbol fthora diatoniki di		
U+1D0BE	ğ‚¾	1D000..1D0FF	Byzantine Musical Symbols	Byzantine musical symbol fthora skliron diatonon di		
U+1D0BF	ğ‚¿	1D000..1D0FF	Byzantine Musical Symbols	Byzantine musical symbol fthora diatoniki ke		
U+1D0C0	ğƒ€	1D000..1D0FF	Byzantine Musical Symbols	Byzantine musical symbol fthora diatoniki zo		
U+1D0C1	ğƒ	1D000..1D0FF	Byzantine Musical Symbols	Byzantine musical symbol fthora diatoniki ni kato		
U+1D0C2	ğƒ‚	1D000..1D0FF	Byzantine Musical Symbols	Byzantine musical symbol fthora diatoniki ni ano		
U+1D0C3	ğƒƒ	1D000..1D0FF	Byzantine Musical Symbols	Byzantine musical symbol fthora malakon chroma difonias		
U+1D0C4	ğƒ„	1D000..1D0FF	Byzantine Musical Symbols	Byzantine musical symbol fthora malakon chroma monofonias		
U+1D0C5	ğƒ…	1D000..1D0FF	Byzantine Musical Symbols	Byzantine musical symbol fhtora skliron chroma vasis		
U+1D0C6	ğƒ†	1D000..1D0FF	Byzantine Musical Symbols	Byzantine musical symbol fthora skliron chroma synafi		
U+1D0C7	ğƒ‡	1D000..1D0FF	Byzantine Musical Symbols	Byzantine musical symbol fthora nenano		
U+1D0C8	ğƒˆ	1D000..1D0FF	Byzantine Musical Symbols	Byzantine musical symbol chroa zygos		
U+1D0C9	ğƒ‰	1D000..1D0FF	Byzantine Musical Symbols	Byzantine musical symbol chroa kliton		
U+1D0CA	ğƒŠ	1D000..1D0FF	Byzantine Musical Symbols	Byzantine musical symbol chroa spathi		
U+1D0CB	ğƒ‹	1D000..1D0FF	Byzantine Musical Symbols	Byzantine musical symbol fthora i yfesis tetartimorion		
U+1D0CC	ğƒŒ	1D000..1D0FF	Byzantine Musical Symbols	Byzantine musical symbol fthora enarmonios antifonia		
U+1D0CD	ğƒ	1D000..1D0FF	Byzantine Musical Symbols	Byzantine musical symbol yfesis tritimorion		
U+1D0CE	ğƒ	1D000..1D0FF	Byzantine Musical Symbols	Byzantine musical symbol diesis tritimorion		
U+1D0CF	ğƒ	1D000..1D0FF	Byzantine Musical Symbols	Byzantine musical symbol diesis tetartimorion		
U+1D0D0	ğƒ	1D000..1D0FF	Byzantine Musical Symbols	Byzantine musical symbol diesis apli dyo dodekata		
U+1D0D1	ğƒ‘	1D000..1D0FF	Byzantine Musical Symbols	Byzantine musical symbol diesis monogrammos tessera dodekata		
U+1D0D2	ğƒ’	1D000..1D0FF	Byzantine Musical Symbols	Byzantine musical symbol diesis digrammos ex dodekata		
U+1D0D3	ğƒ“	1D000..1D0FF	Byzantine Musical Symbols	Byzantine musical symbol diesis trigrammos okto dodekata		
U+1D0D4	ğƒ”	1D000..1D0FF	Byzantine Musical Symbols	Byzantine musical symbol yfesis apli dyo dodekata		
U+1D0D5	ğƒ•	1D000..1D0FF	Byzantine Musical Symbols	Byzantine musical symbol yfesis monogrammos tessera dodekata		
U+1D0D6	ğƒ–	1D000..1D0FF	Byzantine Musical Symbols	Byzantine musical symbol yfesis digrammos ex dodekata		
U+1D0D7	ğƒ—	1D000..1D0FF	Byzantine Musical Symbols	Byzantine musical symbol yfesis trigrammos okto dodekata		
U+1D0D8	ğƒ˜	1D000..1D0FF	Byzantine Musical Symbols	Byzantine musical symbol geniki diesis		
U+1D0D9	ğƒ™	1D000..1D0FF	Byzantine Musical Symbols	Byzantine musical symbol geniki yfesis		
U+1D0DA	ğƒš	1D000..1D0FF	Byzantine Musical Symbols	Byzantine musical symbol diastoli apli mikri		
U+1D0DB	ğƒ›	1D000..1D0FF	Byzantine Musical Symbols	Byzantine musical symbol diastoli apli megali		
U+1D0DC	ğƒœ	1D000..1D0FF	Byzantine Musical Symbols	Byzantine musical symbol diastoli dipli		
U+1D0DD	ğƒ	1D000..1D0FF	Byzantine Musical Symbols	Byzantine musical symbol diastoli theseos		
U+1D0DE	ğƒ	1D000..1D0FF	Byzantine Musical Symbols	Byzantine musical symbol simansis theseos		
U+1D0DF	ğƒŸ	1D000..1D0FF	Byzantine Musical Symbols	Byzantine musical symbol simansis theseos disimou		
U+1D0E0	ğƒ 	1D000..1D0FF	Byzantine Musical Symbols	Byzantine musical symbol simansis theseos trisimou		
U+1D0E1	ğƒ¡	1D000..1D0FF	Byzantine Musical Symbols	Byzantine musical symbol simansis theseos tetrasimou		
U+1D0E2	ğƒ¢	1D000..1D0FF	Byzantine Musical Symbols	Byzantine musical symbol simansis arseos		
U+1D0E3	ğƒ£	1D000..1D0FF	Byzantine Musical Symbols	Byzantine musical symbol simansis arseos disimou		
U+1D0E4	ğƒ¤	1D000..1D0FF	Byzantine Musical Symbols	Byzantine musical symbol simansis arseos trisimou		
U+1D0E5	ğƒ¥	1D000..1D0FF	Byzantine Musical Symbols	Byzantine musical symbol simansis arseos tetrasimou		
U+1D0E6	ğƒ¦	1D000..1D0FF	Byzantine Musical Symbols	Byzantine musical symbol digramma gg		
U+1D0E7	ğƒ§	1D000..1D0FF	Byzantine Musical Symbols	Byzantine musical symbol diftoggos ou		
U+1D0E8	ğƒ¨	1D000..1D0FF	Byzantine Musical Symbols	Byzantine musical symbol stigma		
U+1D0E9	ğƒ©	1D000..1D0FF	Byzantine Musical Symbols	Byzantine musical symbol arktiko pa		
U+1D0EA	ğƒª	1D000..1D0FF	Byzantine Musical Symbols	Byzantine musical symbol arktiko vou		
U+1D0EB	ğƒ«	1D000..1D0FF	Byzantine Musical Symbols	Byzantine musical symbol arktiko ga		
U+1D0EC	ğƒ¬	1D000..1D0FF	Byzantine Musical Symbols	Byzantine musical symbol arktiko di		
U+1D0ED	ğƒ­	1D000..1D0FF	Byzantine Musical Symbols	Byzantine musical symbol arktiko ke		
U+1D0EE	ğƒ®	1D000..1D0FF	Byzantine Musical Symbols	Byzantine musical symbol arktiko zo		
U+1D0EF	ğƒ¯	1D000..1D0FF	Byzantine Musical Symbols	Byzantine musical symbol arktiko ni		
U+1D0F0	ğƒ°	1D000..1D0FF	Byzantine Musical Symbols	Byzantine musical symbol kentimata neo meso		
U+1D0F1	ğƒ±	1D000..1D0FF	Byzantine Musical Symbols	Byzantine musical symbol kentima neo meso		
U+1D0F2	ğƒ²	1D000..1D0FF	Byzantine Musical Symbols	Byzantine musical symbol kentimata neo kato		
U+1D0F3	ğƒ³	1D000..1D0FF	Byzantine Musical Symbols	Byzantine musical symbol kentima neo kato		
U+1D0F4	ğƒ´	1D000..1D0FF	Byzantine Musical Symbols	Byzantine musical symbol klasma kato		
U+1D0F5	ğƒµ	1D000..1D0FF	Byzantine Musical Symbols	Byzantine musical symbol gorgon neo kato		
