code_point	symbol	block	block_name	name	tab_completion	latex_code
1E900	"""ğ¤€"""	1E900..1E95F	Adlam	Adlam capital letter alif		
1E901	"""ğ¤"""	1E900..1E95F	Adlam	Adlam capital letter daali		
1E902	"""ğ¤‚"""	1E900..1E95F	Adlam	Adlam capital letter laam		
1E903	"""ğ¤ƒ"""	1E900..1E95F	Adlam	Adlam capital letter miim		
1E904	"""ğ¤„"""	1E900..1E95F	Adlam	Adlam capital letter ba		
1E905	"""ğ¤…"""	1E900..1E95F	Adlam	Adlam capital letter sinnyiiyhe		
1E906	"""ğ¤†"""	1E900..1E95F	Adlam	Adlam capital letter pe		
1E907	"""ğ¤‡"""	1E900..1E95F	Adlam	Adlam capital letter bhe		
1E908	"""ğ¤ˆ"""	1E900..1E95F	Adlam	Adlam capital letter ra		
1E909	"""ğ¤‰"""	1E900..1E95F	Adlam	Adlam capital letter e		
1E90A	"""ğ¤Š"""	1E900..1E95F	Adlam	Adlam capital letter fa		
1E90B	"""ğ¤‹"""	1E900..1E95F	Adlam	Adlam capital letter i		
1E90C	"""ğ¤Œ"""	1E900..1E95F	Adlam	Adlam capital letter o		
1E90D	"""ğ¤"""	1E900..1E95F	Adlam	Adlam capital letter dha		
1E90E	"""ğ¤"""	1E900..1E95F	Adlam	Adlam capital letter yhe		
1E90F	"""ğ¤"""	1E900..1E95F	Adlam	Adlam capital letter waw		
1E910	"""ğ¤"""	1E900..1E95F	Adlam	Adlam capital letter nun		
1E911	"""ğ¤‘"""	1E900..1E95F	Adlam	Adlam capital letter kaf		
1E912	"""ğ¤’"""	1E900..1E95F	Adlam	Adlam capital letter ya		
1E913	"""ğ¤“"""	1E900..1E95F	Adlam	Adlam capital letter u		
1E914	"""ğ¤”"""	1E900..1E95F	Adlam	Adlam capital letter jiim		
1E915	"""ğ¤•"""	1E900..1E95F	Adlam	Adlam capital letter chi		
1E916	"""ğ¤–"""	1E900..1E95F	Adlam	Adlam capital letter ha		
1E917	"""ğ¤—"""	1E900..1E95F	Adlam	Adlam capital letter qaaf		
1E918	"""ğ¤˜"""	1E900..1E95F	Adlam	Adlam capital letter ga		
1E919	"""ğ¤™"""	1E900..1E95F	Adlam	Adlam capital letter nya		
1E91A	"""ğ¤š"""	1E900..1E95F	Adlam	Adlam capital letter tu		
1E91B	"""ğ¤›"""	1E900..1E95F	Adlam	Adlam capital letter nha		
1E91C	"""ğ¤œ"""	1E900..1E95F	Adlam	Adlam capital letter va		
1E91D	"""ğ¤"""	1E900..1E95F	Adlam	Adlam capital letter kha		
1E91E	"""ğ¤"""	1E900..1E95F	Adlam	Adlam capital letter gbe		
1E91F	"""ğ¤Ÿ"""	1E900..1E95F	Adlam	Adlam capital letter zal		
1E920	"""ğ¤ """	1E900..1E95F	Adlam	Adlam capital letter kpo		
1E921	"""ğ¤¡"""	1E900..1E95F	Adlam	Adlam capital letter sha		
1E922	"""ğ¤¢"""	1E900..1E95F	Adlam	Adlam small letter alif		
1E923	"""ğ¤£"""	1E900..1E95F	Adlam	Adlam small letter daali		
1E924	"""ğ¤¤"""	1E900..1E95F	Adlam	Adlam small letter laam		
1E925	"""ğ¤¥"""	1E900..1E95F	Adlam	Adlam small letter miim		
1E926	"""ğ¤¦"""	1E900..1E95F	Adlam	Adlam small letter ba		
1E927	"""ğ¤§"""	1E900..1E95F	Adlam	Adlam small letter sinnyiiyhe		
1E928	"""ğ¤¨"""	1E900..1E95F	Adlam	Adlam small letter pe		
1E929	"""ğ¤©"""	1E900..1E95F	Adlam	Adlam small letter bhe		
1E92A	"""ğ¤ª"""	1E900..1E95F	Adlam	Adlam small letter ra		
1E92B	"""ğ¤«"""	1E900..1E95F	Adlam	Adlam small letter e		
1E92C	"""ğ¤¬"""	1E900..1E95F	Adlam	Adlam small letter fa		
1E92D	"""ğ¤­"""	1E900..1E95F	Adlam	Adlam small letter i		
1E92E	"""ğ¤®"""	1E900..1E95F	Adlam	Adlam small letter o		
1E92F	"""ğ¤¯"""	1E900..1E95F	Adlam	Adlam small letter dha		
1E930	"""ğ¤°"""	1E900..1E95F	Adlam	Adlam small letter yhe		
1E931	"""ğ¤±"""	1E900..1E95F	Adlam	Adlam small letter waw		
1E932	"""ğ¤²"""	1E900..1E95F	Adlam	Adlam small letter nun		
1E933	"""ğ¤³"""	1E900..1E95F	Adlam	Adlam small letter kaf		
1E934	"""ğ¤´"""	1E900..1E95F	Adlam	Adlam small letter ya		
1E935	"""ğ¤µ"""	1E900..1E95F	Adlam	Adlam small letter u		
1E936	"""ğ¤¶"""	1E900..1E95F	Adlam	Adlam small letter jiim		
1E937	"""ğ¤·"""	1E900..1E95F	Adlam	Adlam small letter chi		
1E938	"""ğ¤¸"""	1E900..1E95F	Adlam	Adlam small letter ha		
1E939	"""ğ¤¹"""	1E900..1E95F	Adlam	Adlam small letter qaaf		
1E93A	"""ğ¤º"""	1E900..1E95F	Adlam	Adlam small letter ga		
1E93B	"""ğ¤»"""	1E900..1E95F	Adlam	Adlam small letter nya		
1E93C	"""ğ¤¼"""	1E900..1E95F	Adlam	Adlam small letter tu		
1E93D	"""ğ¤½"""	1E900..1E95F	Adlam	Adlam small letter nha		
1E93E	"""ğ¤¾"""	1E900..1E95F	Adlam	Adlam small letter va		
1E93F	"""ğ¤¿"""	1E900..1E95F	Adlam	Adlam small letter kha		
1E940	"""ğ¥€"""	1E900..1E95F	Adlam	Adlam small letter gbe		
1E941	"""ğ¥"""	1E900..1E95F	Adlam	Adlam small letter zal		
1E942	"""ğ¥‚"""	1E900..1E95F	Adlam	Adlam small letter kpo		
1E943	"""ğ¥ƒ"""	1E900..1E95F	Adlam	Adlam small letter sha		
1E944	"""ğ¥„"""	1E900..1E95F	Adlam	Adlam alif lengthener		
1E945	"""ğ¥…"""	1E900..1E95F	Adlam	Adlam vowel lengthener		
1E946	"""ğ¥†"""	1E900..1E95F	Adlam	Adlam gemination mark		
1E947	"""ğ¥‡"""	1E900..1E95F	Adlam	Adlam hamza		
1E948	"""ğ¥ˆ"""	1E900..1E95F	Adlam	Adlam consonant modifier		
1E949	"""ğ¥‰"""	1E900..1E95F	Adlam	Adlam geminate consonant modifier		
1E94A	"""ğ¥Š"""	1E900..1E95F	Adlam	Adlam nukta		
1E94B	"""ğ¥‹"""	1E900..1E95F	Adlam	Adlam nasalization mark		
1E950	"""ğ¥"""	1E900..1E95F	Adlam	Adlam digit zero		
1E951	"""ğ¥‘"""	1E900..1E95F	Adlam	Adlam digit one		
1E952	"""ğ¥’"""	1E900..1E95F	Adlam	Adlam digit two		
1E953	"""ğ¥“"""	1E900..1E95F	Adlam	Adlam digit three		
1E954	"""ğ¥”"""	1E900..1E95F	Adlam	Adlam digit four		
1E955	"""ğ¥•"""	1E900..1E95F	Adlam	Adlam digit five		
1E956	"""ğ¥–"""	1E900..1E95F	Adlam	Adlam digit six		
1E957	"""ğ¥—"""	1E900..1E95F	Adlam	Adlam digit seven		
1E958	"""ğ¥˜"""	1E900..1E95F	Adlam	Adlam digit eight		
1E959	"""ğ¥™"""	1E900..1E95F	Adlam	Adlam digit nine		
1E95E	"""ğ¥"""	1E900..1E95F	Adlam	Adlam initial exclamation mark		
1E95F	"""ğ¥Ÿ"""	1E900..1E95F	Adlam	Adlam initial question mark		
