code_point	symbol	block	block_name	name	tab_completion	latex_code
U+1E000	ğ€€	1E000..1E02F	Glagolitic Supplement	Combining glagolitic letter azu		
U+1E001	ğ€	1E000..1E02F	Glagolitic Supplement	Combining glagolitic letter buky		
U+1E002	ğ€‚	1E000..1E02F	Glagolitic Supplement	Combining glagolitic letter vede		
U+1E003	ğ€ƒ	1E000..1E02F	Glagolitic Supplement	Combining glagolitic letter glagoli		
U+1E004	ğ€„	1E000..1E02F	Glagolitic Supplement	Combining glagolitic letter dobro		
U+1E005	ğ€…	1E000..1E02F	Glagolitic Supplement	Combining glagolitic letter yestu		
U+1E006	ğ€†	1E000..1E02F	Glagolitic Supplement	Combining glagolitic letter zhivete		
U+1E008	ğ€ˆ	1E000..1E02F	Glagolitic Supplement	Combining glagolitic letter zemlja		
U+1E009	ğ€‰	1E000..1E02F	Glagolitic Supplement	Combining glagolitic letter izhe		
U+1E00A	ğ€Š	1E000..1E02F	Glagolitic Supplement	Combining glagolitic letter initial izhe		
U+1E00B	ğ€‹	1E000..1E02F	Glagolitic Supplement	Combining glagolitic letter i		
U+1E00C	ğ€Œ	1E000..1E02F	Glagolitic Supplement	Combining glagolitic letter djervi		
U+1E00D	ğ€	1E000..1E02F	Glagolitic Supplement	Combining glagolitic letter kako		
U+1E00E	ğ€	1E000..1E02F	Glagolitic Supplement	Combining glagolitic letter ljudije		
U+1E00F	ğ€	1E000..1E02F	Glagolitic Supplement	Combining glagolitic letter myslite		
U+1E010	ğ€	1E000..1E02F	Glagolitic Supplement	Combining glagolitic letter nashi		
U+1E011	ğ€‘	1E000..1E02F	Glagolitic Supplement	Combining glagolitic letter onu		
U+1E012	ğ€’	1E000..1E02F	Glagolitic Supplement	Combining glagolitic letter pokoji		
U+1E013	ğ€“	1E000..1E02F	Glagolitic Supplement	Combining glagolitic letter ritsi		
U+1E014	ğ€”	1E000..1E02F	Glagolitic Supplement	Combining glagolitic letter slovo		
U+1E015	ğ€•	1E000..1E02F	Glagolitic Supplement	Combining glagolitic letter tvrido		
U+1E016	ğ€–	1E000..1E02F	Glagolitic Supplement	Combining glagolitic letter uku		
U+1E017	ğ€—	1E000..1E02F	Glagolitic Supplement	Combining glagolitic letter fritu		
U+1E018	ğ€˜	1E000..1E02F	Glagolitic Supplement	Combining glagolitic letter heru		
U+1E01B	ğ€›	1E000..1E02F	Glagolitic Supplement	Combining glagolitic letter shta		
U+1E01C	ğ€œ	1E000..1E02F	Glagolitic Supplement	Combining glagolitic letter tsi		
U+1E01D	ğ€	1E000..1E02F	Glagolitic Supplement	Combining glagolitic letter chrivi		
U+1E01E	ğ€	1E000..1E02F	Glagolitic Supplement	Combining glagolitic letter sha		
U+1E01F	ğ€Ÿ	1E000..1E02F	Glagolitic Supplement	Combining glagolitic letter yeru		
U+1E020	ğ€ 	1E000..1E02F	Glagolitic Supplement	Combining glagolitic letter yeri		
U+1E021	ğ€¡	1E000..1E02F	Glagolitic Supplement	Combining glagolitic letter yati		
U+1E023	ğ€£	1E000..1E02F	Glagolitic Supplement	Combining glagolitic letter yu		
U+1E024	ğ€¤	1E000..1E02F	Glagolitic Supplement	Combining glagolitic letter small yus		
U+1E026	ğ€¦	1E000..1E02F	Glagolitic Supplement	Combining glagolitic letter yo		
U+1E027	ğ€§	1E000..1E02F	Glagolitic Supplement	Combining glagolitic letter iotated small yus		
U+1E028	ğ€¨	1E000..1E02F	Glagolitic Supplement	Combining glagolitic letter big yus		
U+1E029	ğ€©	1E000..1E02F	Glagolitic Supplement	Combining glagolitic letter iotated big yus		
U+1E02A	ğ€ª	1E000..1E02F	Glagolitic Supplement	Combining glagolitic letter fita		
