code_point	symbol	block	block_name	name	tab_completion	latex_code
10780	"""ğ€"""	10780..107BF	Latin Extended-F	Modifier letter small capital aa		
10781	"""ğ"""	10780..107BF	Latin Extended-F	Modifier letter superscript triangular colon		
10782	"""ğ‚"""	10780..107BF	Latin Extended-F	Modifier letter superscript half triangular colon		
10783	"""ğƒ"""	10780..107BF	Latin Extended-F	Modifier letter small ae		
10784	"""ğ„"""	10780..107BF	Latin Extended-F	Modifier letter small capital b		
10785	"""ğ…"""	10780..107BF	Latin Extended-F	Modifier letter small b with hook		
10787	"""ğ‡"""	10780..107BF	Latin Extended-F	Modifier letter small dz digraph		
10788	"""ğˆ"""	10780..107BF	Latin Extended-F	Modifier letter small dz digraph with retroflex hook		
10789	"""ğ‰"""	10780..107BF	Latin Extended-F	Modifier letter small dz digraph with curl		
1078A	"""ğŠ"""	10780..107BF	Latin Extended-F	Modifier letter small dezh digraph		
1078B	"""ğ‹"""	10780..107BF	Latin Extended-F	Modifier letter small d with tail		
1078C	"""ğŒ"""	10780..107BF	Latin Extended-F	Modifier letter small d with hook		
1078D	"""ğ"""	10780..107BF	Latin Extended-F	Modifier letter small d with hook and tail		
1078E	"""ğ"""	10780..107BF	Latin Extended-F	Modifier letter small reversed e		
1078F	"""ğ"""	10780..107BF	Latin Extended-F	Modifier letter small closed reversed open e		
10790	"""ğ"""	10780..107BF	Latin Extended-F	Modifier letter small feng digraph		
10791	"""ğ‘"""	10780..107BF	Latin Extended-F	Modifier letter small rams horn		
10792	"""ğ’"""	10780..107BF	Latin Extended-F	Modifier letter small capital g		
10793	"""ğ“"""	10780..107BF	Latin Extended-F	Modifier letter small g with hook		
10794	"""ğ”"""	10780..107BF	Latin Extended-F	Modifier letter small capital g with hook		
10795	"""ğ•"""	10780..107BF	Latin Extended-F	Modifier letter small h with stroke		
10796	"""ğ–"""	10780..107BF	Latin Extended-F	Modifier letter small capital h		
10797	"""ğ—"""	10780..107BF	Latin Extended-F	Modifier letter small heng with hook		
10798	"""ğ˜"""	10780..107BF	Latin Extended-F	Modifier letter small dotless j with stroke and hook		
10799	"""ğ™"""	10780..107BF	Latin Extended-F	Modifier letter small ls digraph		
1079A	"""ğš"""	10780..107BF	Latin Extended-F	Modifier letter small lz digraph		
1079B	"""ğ›"""	10780..107BF	Latin Extended-F	Modifier letter small l with belt		
1079C	"""ğœ"""	10780..107BF	Latin Extended-F	Modifier letter small capital l with belt		
1079D	"""ğ"""	10780..107BF	Latin Extended-F	Modifier letter small l with retroflex hook and belt		
1079E	"""ğ"""	10780..107BF	Latin Extended-F	Modifier letter small lezh		
1079F	"""ğŸ"""	10780..107BF	Latin Extended-F	Modifier letter small lezh with retroflex hook		
107A0	"""ğ """	10780..107BF	Latin Extended-F	Modifier letter small turned y		
107A1	"""ğ¡"""	10780..107BF	Latin Extended-F	Modifier letter small turned y with belt		
107A2	"""ğ¢"""	10780..107BF	Latin Extended-F	Modifier letter small o with stroke		
107A3	"""ğ£"""	10780..107BF	Latin Extended-F	Modifier letter small capital oe		
107A4	"""ğ¤"""	10780..107BF	Latin Extended-F	Modifier letter small closed omega		
107A5	"""ğ¥"""	10780..107BF	Latin Extended-F	Modifier letter small q		
107A6	"""ğ¦"""	10780..107BF	Latin Extended-F	Modifier letter small turned r with long leg		
107A7	"""ğ§"""	10780..107BF	Latin Extended-F	Modifier letter small turned r with long leg and retroflex hook		
107A8	"""ğ¨"""	10780..107BF	Latin Extended-F	Modifier letter small r with tail		
107A9	"""ğ©"""	10780..107BF	Latin Extended-F	Modifier letter small r with fishhook		
107AA	"""ğª"""	10780..107BF	Latin Extended-F	Modifier letter small capital r		
107AB	"""ğ«"""	10780..107BF	Latin Extended-F	Modifier letter small tc digraph with curl		
107AC	"""ğ¬"""	10780..107BF	Latin Extended-F	Modifier letter small ts digraph		
107AD	"""ğ­"""	10780..107BF	Latin Extended-F	Modifier letter small ts digraph with retroflex hook		
107AE	"""ğ®"""	10780..107BF	Latin Extended-F	Modifier letter small tesh digraph		
107AF	"""ğ¯"""	10780..107BF	Latin Extended-F	Modifier letter small t with retroflex hook		
107B0	"""ğ°"""	10780..107BF	Latin Extended-F	Modifier letter small v with right hook		
107B2	"""ğ²"""	10780..107BF	Latin Extended-F	Modifier letter small capital y		
107B3	"""ğ³"""	10780..107BF	Latin Extended-F	Modifier letter glottal stop with stroke		
107B4	"""ğ´"""	10780..107BF	Latin Extended-F	Modifier letter reversed glottal stop with stroke		
107B5	"""ğµ"""	10780..107BF	Latin Extended-F	Modifier letter bilabial click		
107B6	"""ğ¶"""	10780..107BF	Latin Extended-F	Modifier letter dental click		
107B7	"""ğ·"""	10780..107BF	Latin Extended-F	Modifier letter lateral click		
107B8	"""ğ¸"""	10780..107BF	Latin Extended-F	Modifier letter alveolar click		
107B9	"""ğ¹"""	10780..107BF	Latin Extended-F	Modifier letter retroflex click with retroflex hook		
107BA	"""ğº"""	10780..107BF	Latin Extended-F	Modifier letter small s with curl		
