code_point	symbol	block	block_name	name	tab_completion	latex_code
1EC71	"""ğ±±"""	1EC70..1ECBF	Indic Siyaq Numbers	Indic siyaq number one		
1EC72	"""ğ±²"""	1EC70..1ECBF	Indic Siyaq Numbers	Indic siyaq number two		
1EC73	"""ğ±³"""	1EC70..1ECBF	Indic Siyaq Numbers	Indic siyaq number three		
1EC74	"""ğ±´"""	1EC70..1ECBF	Indic Siyaq Numbers	Indic siyaq number four		
1EC75	"""ğ±µ"""	1EC70..1ECBF	Indic Siyaq Numbers	Indic siyaq number five		
1EC76	"""ğ±¶"""	1EC70..1ECBF	Indic Siyaq Numbers	Indic siyaq number six		
1EC77	"""ğ±·"""	1EC70..1ECBF	Indic Siyaq Numbers	Indic siyaq number seven		
1EC78	"""ğ±¸"""	1EC70..1ECBF	Indic Siyaq Numbers	Indic siyaq number eight		
1EC79	"""ğ±¹"""	1EC70..1ECBF	Indic Siyaq Numbers	Indic siyaq number nine		
1EC7A	"""ğ±º"""	1EC70..1ECBF	Indic Siyaq Numbers	Indic siyaq number ten		
1EC7B	"""ğ±»"""	1EC70..1ECBF	Indic Siyaq Numbers	Indic siyaq number twenty		
1EC7C	"""ğ±¼"""	1EC70..1ECBF	Indic Siyaq Numbers	Indic siyaq number thirty		
1EC7D	"""ğ±½"""	1EC70..1ECBF	Indic Siyaq Numbers	Indic siyaq number forty		
1EC7E	"""ğ±¾"""	1EC70..1ECBF	Indic Siyaq Numbers	Indic siyaq number fifty		
1EC7F	"""ğ±¿"""	1EC70..1ECBF	Indic Siyaq Numbers	Indic siyaq number sixty		
1EC80	"""ğ²€"""	1EC70..1ECBF	Indic Siyaq Numbers	Indic siyaq number seventy		
1EC81	"""ğ²"""	1EC70..1ECBF	Indic Siyaq Numbers	Indic siyaq number eighty		
1EC82	"""ğ²‚"""	1EC70..1ECBF	Indic Siyaq Numbers	Indic siyaq number ninety		
1EC83	"""ğ²ƒ"""	1EC70..1ECBF	Indic Siyaq Numbers	Indic siyaq number one hundred		
1EC84	"""ğ²„"""	1EC70..1ECBF	Indic Siyaq Numbers	Indic siyaq number two hundred		
1EC85	"""ğ²…"""	1EC70..1ECBF	Indic Siyaq Numbers	Indic siyaq number three hundred		
1EC86	"""ğ²†"""	1EC70..1ECBF	Indic Siyaq Numbers	Indic siyaq number four hundred		
1EC87	"""ğ²‡"""	1EC70..1ECBF	Indic Siyaq Numbers	Indic siyaq number five hundred		
1EC88	"""ğ²ˆ"""	1EC70..1ECBF	Indic Siyaq Numbers	Indic siyaq number six hundred		
1EC89	"""ğ²‰"""	1EC70..1ECBF	Indic Siyaq Numbers	Indic siyaq number seven hundred		
1EC8A	"""ğ²Š"""	1EC70..1ECBF	Indic Siyaq Numbers	Indic siyaq number eight hundred		
1EC8B	"""ğ²‹"""	1EC70..1ECBF	Indic Siyaq Numbers	Indic siyaq number nine hundred		
1EC8C	"""ğ²Œ"""	1EC70..1ECBF	Indic Siyaq Numbers	Indic siyaq number one thousand		
1EC8D	"""ğ²"""	1EC70..1ECBF	Indic Siyaq Numbers	Indic siyaq number two thousand		
1EC8E	"""ğ²"""	1EC70..1ECBF	Indic Siyaq Numbers	Indic siyaq number three thousand		
1EC8F	"""ğ²"""	1EC70..1ECBF	Indic Siyaq Numbers	Indic siyaq number four thousand		
1EC90	"""ğ²"""	1EC70..1ECBF	Indic Siyaq Numbers	Indic siyaq number five thousand		
1EC91	"""ğ²‘"""	1EC70..1ECBF	Indic Siyaq Numbers	Indic siyaq number six thousand		
1EC92	"""ğ²’"""	1EC70..1ECBF	Indic Siyaq Numbers	Indic siyaq number seven thousand		
1EC93	"""ğ²“"""	1EC70..1ECBF	Indic Siyaq Numbers	Indic siyaq number eight thousand		
1EC94	"""ğ²”"""	1EC70..1ECBF	Indic Siyaq Numbers	Indic siyaq number nine thousand		
1EC95	"""ğ²•"""	1EC70..1ECBF	Indic Siyaq Numbers	Indic siyaq number ten thousand		
1EC96	"""ğ²–"""	1EC70..1ECBF	Indic Siyaq Numbers	Indic siyaq number twenty thousand		
1EC97	"""ğ²—"""	1EC70..1ECBF	Indic Siyaq Numbers	Indic siyaq number thirty thousand		
1EC98	"""ğ²˜"""	1EC70..1ECBF	Indic Siyaq Numbers	Indic siyaq number forty thousand		
1EC99	"""ğ²™"""	1EC70..1ECBF	Indic Siyaq Numbers	Indic siyaq number fifty thousand		
1EC9A	"""ğ²š"""	1EC70..1ECBF	Indic Siyaq Numbers	Indic siyaq number sixty thousand		
1EC9B	"""ğ²›"""	1EC70..1ECBF	Indic Siyaq Numbers	Indic siyaq number seventy thousand		
1EC9C	"""ğ²œ"""	1EC70..1ECBF	Indic Siyaq Numbers	Indic siyaq number eighty thousand		
1EC9D	"""ğ²"""	1EC70..1ECBF	Indic Siyaq Numbers	Indic siyaq number ninety thousand		
1EC9E	"""ğ²"""	1EC70..1ECBF	Indic Siyaq Numbers	Indic siyaq number lakh		
1EC9F	"""ğ²Ÿ"""	1EC70..1ECBF	Indic Siyaq Numbers	Indic siyaq number lakhan		
1ECA0	"""ğ² """	1EC70..1ECBF	Indic Siyaq Numbers	Indic siyaq lakh mark		
1ECA1	"""ğ²¡"""	1EC70..1ECBF	Indic Siyaq Numbers	Indic siyaq number karor		
1ECA2	"""ğ²¢"""	1EC70..1ECBF	Indic Siyaq Numbers	Indic siyaq number karoran		
1ECA3	"""ğ²£"""	1EC70..1ECBF	Indic Siyaq Numbers	Indic siyaq number prefixed one		
1ECA4	"""ğ²¤"""	1EC70..1ECBF	Indic Siyaq Numbers	Indic siyaq number prefixed two		
1ECA5	"""ğ²¥"""	1EC70..1ECBF	Indic Siyaq Numbers	Indic siyaq number prefixed three		
1ECA6	"""ğ²¦"""	1EC70..1ECBF	Indic Siyaq Numbers	Indic siyaq number prefixed four		
1ECA7	"""ğ²§"""	1EC70..1ECBF	Indic Siyaq Numbers	Indic siyaq number prefixed five		
1ECA8	"""ğ²¨"""	1EC70..1ECBF	Indic Siyaq Numbers	Indic siyaq number prefixed six		
1ECA9	"""ğ²©"""	1EC70..1ECBF	Indic Siyaq Numbers	Indic siyaq number prefixed seven		
1ECAA	"""ğ²ª"""	1EC70..1ECBF	Indic Siyaq Numbers	Indic siyaq number prefixed eight		
1ECAB	"""ğ²«"""	1EC70..1ECBF	Indic Siyaq Numbers	Indic siyaq number prefixed nine		
1ECAC	"""ğ²¬"""	1EC70..1ECBF	Indic Siyaq Numbers	Indic siyaq placeholder		
1ECAD	"""ğ²­"""	1EC70..1ECBF	Indic Siyaq Numbers	Indic siyaq fraction one quarter		
1ECAE	"""ğ²®"""	1EC70..1ECBF	Indic Siyaq Numbers	Indic siyaq fraction one half		
1ECAF	"""ğ²¯"""	1EC70..1ECBF	Indic Siyaq Numbers	Indic siyaq fraction three quarters		
1ECB0	"""ğ²°"""	1EC70..1ECBF	Indic Siyaq Numbers	Indic siyaq rupee mark		
1ECB1	"""ğ²±"""	1EC70..1ECBF	Indic Siyaq Numbers	Indic siyaq number alternate one		
1ECB2	"""ğ²²"""	1EC70..1ECBF	Indic Siyaq Numbers	Indic siyaq number alternate two		
1ECB3	"""ğ²³"""	1EC70..1ECBF	Indic Siyaq Numbers	Indic siyaq number alternate ten thousand		
1ECB4	"""ğ²´"""	1EC70..1ECBF	Indic Siyaq Numbers	Indic siyaq alternate lakh mark		
